file path,line #,comment,satd
locust/locust/test/test_log.py,17,"Gevent outputs all unhandled exceptions to stderr, so we'll suppress that in this test",not
locust/locust/test/test_log.py,76,check that custom message of root logger is also printed,not
locust/locust/test/test_log.py,81,check that custom message of custom_logger is also printed,not
locust/locust/test/test_log.py,137,make sure print still appears in output,not
locust/locust/test/test_log.py,140,check that log messages don't go into output,not
locust/locust/test/test_log.py,144,check that log messages goes into file,not
locust/locust/test/test_log.py,157,check that message of custom logger also went into log file,not
locust/locust/test/test_zmqrpc.py,34,We have to wait for the client to finish connecting,not
locust/locust/test/test_zmqrpc.py,35,before sending a msg to it.,not
locust/locust/test/testcases.py,129,Prevent args passed to test runner from being passed to Locust,not
locust/locust/test/testcases.py,136,When running the tests in Python 3 we get warnings about unclosed sockets.,not
locust/locust/test/testcases.py,137,"This causes tests that depends on calls to sys.stderr to fail, so we'll",not
locust/locust/test/testcases.py,138,suppress those warnings. For more info see:,not
locust/locust/test/testcases.py,139,https://github.com/requests/requests/issues/1882,not
locust/locust/test/testcases.py,143,"ResourceWarning doesn't exist in Python 2, but since the warning only appears",not
locust/locust/test/testcases.py,144,on Python 3 we don't need to mock it. Instead we can happily ignore the exception,not
locust/locust/test/testcases.py,147,set up mocked logging handler,not
locust/locust/test/testcases.py,156,set unandled exception flag to False,not
locust/locust/test/testcases.py,160,restore logging class,not
locust/locust/test/test_main.py,172,MacOS only sets up the loopback interface for 127.0.0.1 and not for 127.*.*.*,not
locust/locust/util/cache.py,20,cache miss,not
locust/locust/util/timespan.py,13,if an int is specified we assume they want seconds,not
locust/locust/util/deprecation.py,4,Show deprecation warnings,not
locust/examples/use_as_lib.py,22,setup Environment and Runner,not
locust/examples/use_as_lib.py,26,start a WebUI instance,not
locust/examples/use_as_lib.py,29,start a greenlet that periodically outputs the current stats,not
locust/examples/use_as_lib.py,32,start the test,not
locust/examples/use_as_lib.py,35,in 60 seconds stop the runner,not
locust/examples/use_as_lib.py,38,wait for the greenlets,not
locust/examples/use_as_lib.py,41,stop the web server for good measures,not
locust/examples/basic.py,11,one can specify tasks like this,not
locust/examples/basic.py,14,but it might be convenient to use the @task decorator,not
locust/examples/dynamice_user_credentials.py,1,locustfile.py,not
locust/examples/dynamice_user_credentials.py,19,user should be logged in here (unless the USER_CREDENTIALS ran out),not
locust/examples/browse_docs_sequence_test.py,1,This locust test script example will simulate a user,not
locust/examples/browse_docs_sequence_test.py,2,browsing the Locust documentation on https://docs.locust.io/,not
locust/examples/browse_docs_sequence_test.py,13,assume all users arrive at the index page,not
locust/examples/browse_docs_sequence_test.py,43,"we assume someone who is browsing the Locust docs,",not
locust/examples/browse_docs_sequence_test.py,44,generally has a quite long waiting time (between,not
locust/examples/browse_docs_sequence_test.py,45,"20 and 600 seconds), since there's a bunch of text",not
locust/examples/browse_docs_sequence_test.py,46,on each page,not
locust/examples/browse_docs_test.py,1,This locust test script example will simulate a user,not
locust/examples/browse_docs_test.py,2,browsing the Locust documentation on https://docs.locust.io/,not
locust/examples/browse_docs_test.py,11,assume all users arrive at the index page,not
locust/examples/browse_docs_test.py,44,"we assume someone who is browsing the Locust docs,",not
locust/examples/browse_docs_test.py,45,generally has a quite long waiting time (between,not
locust/examples/browse_docs_test.py,46,"20 and 600 seconds), since there's a bunch of text",not
locust/examples/browse_docs_test.py,47,on each page,not
locust/examples/events.py,1,-*- coding: utf-8 -*-,not
locust/examples/events.py,39,this code is only run on the master node (the web_ui instance doesn't exist on workers),not
locust/examples/custom_wait_function.py,11,one can specify tasks like this,not
locust/examples/custom_wait_function.py,14,but it might be convenient to use the @task decorator,not
locust/examples/custom_wait_function.py,24,Most task inter-arrival times approximate to exponential distributions,not
locust/examples/custom_wait_function.py,25,We will model this wait time as exponentially distributed with a mean of 1 second,not
locust/examples/multiple_hosts.py,15,but it might be convenient to use the @task decorator,not
locust/examples/custom_xmlrpc_client/xmlrpc_locustfile.py,28,"In this example, I've hardcoded response_length=0. If we would want the response length to be",not
locust/examples/custom_xmlrpc_client/xmlrpc_locustfile.py,29,"reported correctly in the statistics, we would probably need to hook in at a lower level",not
locust/docs/conf.py,1,-*- coding: utf-8 -*-,not
locust/docs/conf.py,2,,not
locust/docs/conf.py,3,This file is execfile()d with the current directory set to its containing dir.,not
locust/docs/conf.py,4,,not
locust/docs/conf.py,5,"The contents of this file are pickled, so don't put values in the namespace",not
locust/docs/conf.py,6,"that aren't pickleable (module imports are okay, they're removed automatically).",not
locust/docs/conf.py,7,,not
locust/docs/conf.py,8,All configuration values have a default value; values that are commented out,not
locust/docs/conf.py,9,serve to show the default value.,not
locust/docs/conf.py,17,Run command `locust --help` and store output in cli-help-output.txt which is included in the docs,not
locust/docs/conf.py,27,Generate RST table with help/descriptions for all available environment variables,not
locust/docs/conf.py,61,"The default replacements for |version| and |release|, also used in various",not
locust/docs/conf.py,62,other places throughout the built documents.,not
locust/docs/conf.py,63,,not
locust/docs/conf.py,64,The short X.Y version.,not
locust/docs/conf.py,67,General configuration,not
locust/docs/conf.py,68,---------------------,not
locust/docs/conf.py,70,"Add any Sphinx extension module names here, as strings. They can be extensions",not
locust/docs/conf.py,71,coming with Sphinx (named 'sphinx.ext.*') or your custom ones.,not
locust/docs/conf.py,74,autoclass options,not
locust/docs/conf.py,75,"autoclass_content = ""both""",not
locust/docs/conf.py,77,I would have liked to use 'description' but unfortunately it too is very verbose,not
locust/docs/conf.py,79,"Add any paths that contain templates here, relative to this directory.",not
locust/docs/conf.py,80,"templates_path = [""_templates""]",not
locust/docs/conf.py,82,The suffix of source filenames.,not
locust/docs/conf.py,85,The master toctree document.,not
locust/docs/conf.py,88,General substitutions.,not
locust/docs/conf.py,90,copyright = '',not
locust/docs/conf.py,92,Intersphinx config,not
locust/docs/conf.py,98,"The full version, including alpha/beta/rc tags.",not
locust/docs/conf.py,101,"There are two options for replacing |today|: either, you set today to some",not
locust/docs/conf.py,102,"non-false value, then it is used:",not
locust/docs/conf.py,103,today = '',not
locust/docs/conf.py,104,"Else, today_fmt is used as the format for a strftime call.",not
locust/docs/conf.py,107,List of documents that shouldn't be included in the build.,not
locust/docs/conf.py,108,unused_docs = [],not
locust/docs/conf.py,110,"If true, '()' will be appended to :func: etc. cross-reference text.",not
locust/docs/conf.py,113,"If true, the current module name will be prepended to all description",not
locust/docs/conf.py,114,unit titles (such as .. function::).,not
locust/docs/conf.py,117,"If true, sectionauthor and moduleauthor directives will be shown in the",not
locust/docs/conf.py,118,output. They are ignored by default.,not
locust/docs/conf.py,121,Sphinx will recurse into subversion configuration folders and try to read,not
locust/docs/conf.py,122,any document file within. These should be ignored.,not
locust/docs/conf.py,123,Note: exclude_dirnames is new in Sphinx 0.5,not
locust/docs/conf.py,126,Options for HTML output,not
locust/docs/conf.py,127,-----------------------,not
locust/docs/conf.py,133,"on_rtd is whether we are on readthedocs.org, this line of code grabbed from docs.readthedocs.org",not
locust/docs/conf.py,136,only import and set the theme if we're building docs locally,not
locust/docs/conf.py,142,Custom CSS overrides,not
locust/docs/conf.py,149,HTML theme,not
locust/docs/conf.py,150,"html_theme = ""haiku""",not
locust/docs/conf.py,152,"html_theme = ""default""",not
locust/docs/conf.py,153,html_theme_options = {,not
locust/docs/conf.py,154,"""rightsidebar"": ""true"",",not
locust/docs/conf.py,155,"""codebgcolor"": ""#fafcfa"",",not
locust/docs/conf.py,156,"""bodyfont"": ""Arial"",",not
locust/docs/conf.py,157,},not
locust/docs/conf.py,159,The name of the Pygments (syntax highlighting) style to use.,not
locust/docs/conf.py,160,pygments_style = 'trac',not
