file path,line #,comment,satd
locust/setup.py,1,-*- coding: utf-8 -*-,not
locust/setup.py,9,parse version from locust/__init__.py,not
locust/locust/web.py,1,-*- coding: utf-8 -*-,not
locust/locust/web.py,118,"since we have mulitple User classes with different host attributes, we'll",not
locust/locust/web.py,119,inform that specifying host will override the host for all User classes,not
locust/locust/web.py,222,Truncate the total number of stats and errors displayed since a large number of rows will cause the app,not
locust/locust/web.py,223,to render extremely slowly. Aggregate stats should be preserved.,not
locust/locust/web.py,279,start the web server,not
locust/locust/main.py,55,Start with making sure the current working dir is in the sys.path,not
locust/locust/main.py,57,Get directory and locustfile name,not
locust/locust/main.py,59,"If the directory isn't in the PYTHONPATH, add it so our import will work",not
locust/locust/main.py,65,"If the directory IS in the PYTHONPATH, move it to the front temporarily,",SATD
locust/locust/main.py,66,otherwise other locustfiles -- like Locusts's own -- may scoop the intended,not
locust/locust/main.py,67,one.,not
locust/locust/main.py,71,Store index for later restoration,not
locust/locust/main.py,73,"Add to front, then remove from original position",not
locust/locust/main.py,76,Perform the import,not
locust/locust/main.py,78,Remove directory from path if we added it ourselves (just to be neat),not
locust/locust/main.py,81,Put back in original index if we moved it,not
locust/locust/main.py,85,Return our two-tuple,not
locust/locust/main.py,108,"find specified locustfile and make sure it exists, using a very simplified",not
locust/locust/main.py,109,command line parser that is only used to parse the -f option,not
locust/locust/main.py,112,import the locustfile,not
locust/locust/main.py,115,parse all command line options,not
locust/locust/main.py,122,setup logging,not
locust/locust/main.py,143,make sure specified User exists,not
locust/locust/main.py,153,list() call is needed to consume the dict_view object in Python 3,not
locust/locust/main.py,156,create locust Environment,not
locust/locust/main.py,203,"main_greenlet is pointing to runners.greenlet by default, it will point the web greenlet later if in web mode",not
locust/locust/main.py,225,start Web UI,not
locust/locust/main.py,227,spawn web greenlet,not
locust/locust/main.py,232,"special check for ""*"" so that we're consistent with --master-bind-host",not
locust/locust/main.py,251,Fire locust init event which can be used by end-users' code to run setup code that,not
locust/locust/main.py,252,"need access to the Environment, Runner or WebUI",not
locust/locust/main.py,256,headless mode,not
locust/locust/main.py,258,wait for worker nodes to connect,not
locust/locust/main.py,264,apply headless mode defaults,not
locust/locust/main.py,272,start the test,not
locust/locust/main.py,283,spawn stats printing greenlet,not
locust/locust/main.py,310,install SIGTERM handler,not
locust/locust/log.py,7,Global flag that we set to True if any unhandled exception occurs in a greenlet,not
locust/locust/log.py,8,Used by main.py to set the process return code to non-zero,not
locust/locust/log.py,54,if a file has been specified add a file logging handler and set,not
locust/locust/log.py,55,the locust and root loggers to use it,not
locust/locust/clients.py,55,Check for basic authentication,not
locust/locust/clients.py,62,remove username and password from the base_url,not
locust/locust/clients.py,64,configure requests to use basic auth,not
locust/locust/clients.py,104,prepend url with hostname unless it's already an absolute URL,not
locust/locust/clients.py,107,store meta data that is used when reporting the request to locust's statistics,not
locust/locust/clients.py,110,set up pre_request hook for attaching meta data to the request object,not
locust/locust/clients.py,116,record the consumed time,not
locust/locust/clients.py,122,"get the length of the content, but if the argument stream is set to True, we take",not
locust/locust/clients.py,123,"the size from the content-length header, in order to not trigger fetching of the body",not
locust/locust/clients.py,134,"Since we use the Exception message when grouping failures, in order to not get",not
locust/locust/clients.py,135,"multiple failure entries for different URLs for the same name argument, we need",not
locust/locust/clients.py,136,to temporarily override the reponse.url attribute,not
locust/locust/clients.py,173,"with this status_code, content returns None",not
locust/locust/clients.py,191,copy data from response to this object,not
locust/locust/clients.py,206,if the user has already manually marked this response as failure or success,not
locust/locust/clients.py,207,we can ignore the default haviour of letting the response code determine the outcome,not
locust/locust/clients.py,214,we want other unknown exceptions to be raised,not
locust/locust/runners.py,1,-*- coding: utf-8 -*-,not
locust/locust/runners.py,57,set up event listeners for recording requests,not
locust/locust/runners.py,69,register listener that resets stats when hatching is complete,not
locust/locust/runners.py,78,don't leave any stray greenlets if runner is removed,not
locust/locust/runners.py,120,create users depending on weight,not
locust/locust/runners.py,124,used to keep track of the amount of rounding was done if we need,not
locust/locust/runners.py,125,to add/remove some instances from bucket,not
locust/locust/runners.py,128,"We got too few User classes in the bucket, so we need to create a few extra users,",not
locust/locust/runners.py,129,and we do this by iterating over each of the User classes - starting with the one,not
locust/locust/runners.py,130,where the residual from the rounding was the largest - and creating one of each until,not
locust/locust/runners.py,131,we get the correct amount,not
locust/locust/runners.py,135,We've got too many users due to rounding errors so we need to remove some,not
locust/locust/runners.py,200,"User.stop() returns False if the greenlet was not stopped, so we'll need",not
locust/locust/runners.py,201,to add it's greenlet to our stopping Group so we can wait for it to finish it's task,not
locust/locust/runners.py,236,Dynamically changing the user count,not
locust/locust/runners.py,240,Stop some users,not
locust/locust/runners.py,244,Spawn some users,not
locust/locust/runners.py,283,if we are currently hatching users we need to kill the hatching greenlet first,not
locust/locust/runners.py,315,register listener thats logs the exception for the local runner,not
locust/locust/runners.py,327,if we're not already running we'll fire the test_start event,not
locust/locust/runners.py,331,kill existing hatching_greenlet before we start a new one,not
locust/locust/runners.py,406,listener that gathers info on how many users the worker has spawned,not
locust/locust/runners.py,415,register listener that sends quit message to worker nodes,not
locust/locust/runners.py,479,fire test_stop event if state isn't already stopped,not
locust/locust/runners.py,484,wait for final stats report from all workers,not
locust/locust/runners.py,535,balance the load distribution when new client joins,not
locust/locust/runners.py,537,emit a warning if the worker's clock seem to be out of sync with our clock,not
locust/locust/runners.py,538,"if abs(time() - msg.data[""time""]) > 5.0:",not
locust/locust/runners.py,539,"warnings.warn(""The worker node's clock seem to be out of sync. For the statistics to be correct the different locust servers need to have synchronized clocks."")",not
locust/locust/runners.py,550,used to fail the test in the end,not
locust/locust/runners.py,551,used to suppress logging for this node,not
locust/locust/runners.py,606,"register listener for when all users have hatched, and report it to the master node",not
locust/locust/runners.py,612,register listener that adds the current number of spawned users to the report that is sent to the master node,not
locust/locust/runners.py,617,register listener that sends quit message to master,not
locust/locust/runners.py,622,register listener thats sends user exceptions to master,not
locust/locust/runners.py,661,kill existing hatching greenlet before we launch new one,not
locust/locust/runners.py,673,"send a final report, in case there were any samples not yet reported",not
locust/locust/env.py,122,Create a new RequestStats with use_response_times_cache set to False to save some memory,not
locust/locust/env.py,123,"and CPU cycles, since the response_times_cache is not needed for Worker nodes",not
locust/locust/argument_parser.py,29,Obtain env value,not
locust/locust/argument_parser.py,31,Create .py version if necessary,not
locust/locust/argument_parser.py,34,Does the name contain path elements?,not
locust/locust/argument_parser.py,36,"If so, expand home-directory markers and test for existence",not
locust/locust/argument_parser.py,43,"Otherwise, start in cwd and work downwards towards filesystem root",not
locust/locust/argument_parser.py,53,we've reached the root path which has been checked this iteration,not
locust/locust/argument_parser.py,56,Implicit 'return None' if nothing was found,not
locust/locust/argument_parser.py,71,"epilog="""",",not
locust/locust/argument_parser.py,108,if --help or --version is specified we'll call parse_options which will print the help/version message,not
locust/locust/argument_parser.py,203,if locust should be run in distributed mode as master,not
locust/locust/argument_parser.py,243,if locust should be run in distributed mode as worker,not
locust/locust/argument_parser.py,255,master host options,not
locust/locust/argument_parser.py,377,optparse gives you --version but we have to do it ourselves to get -V too,not
locust/locust/argument_parser.py,410,get a parser that is only able to parse the -f argument,not
locust/locust/argument_parser.py,412,add all the other supported arguments,not
locust/locust/argument_parser.py,414,fire event to provide a hook for locustscripts and plugins to add command line arguments,not
locust/locust/__init__.py,1,Apply Gevent monkey patching of stdlib,not
locust/locust/stats.py,70,if all response times were None,not
locust/locust/stats.py,134,store error in errors dict,not
locust/locust/stats.py,270,get the time,not
locust/locust/stats.py,275,see if we shall make a copy of the respone_times dict and store in the cache,not
locust/locust/stats.py,282,increase total content-length,not
locust/locust/stats.py,303,to avoid to much data that has to be transfered to the master node when,not
locust/locust/stats.py,304,"running in distributed mode, we save the response time rounded in a dict",not
locust/locust/stats.py,305,"so that 147 becomes 150, 3432 becomes 3400 and 58760 becomes 59000",not
locust/locust/stats.py,315,increase request count for the rounded key in response time dict,not
locust/locust/stats.py,347,Since we only use two digits of precision when calculating the median response time,not
locust/locust/stats.py,348,"while still using the exact values for min and max response times, the following checks",not
locust/locust/stats.py,349,makes sure that we don't report a median > max or median < min when a StatsEntry only,not
locust/locust/stats.py,350,have one (or very few) really slow requests,not
locust/locust/stats.py,406,"save the old last_request_timestamp, to see if we should store a new copy",not
locust/locust/stats.py,407,of the response times in the response times cache,not
locust/locust/stats.py,424,"this means self.min_response_time is None, so we can safely replace it",not
locust/locust/stats.py,436,"If we've entered a new second, we'll cache the response times. Note that there",not
locust/locust/stats.py,437,might still be reports from other worker nodes - that contains requests for the same,not
locust/locust/stats.py,438,time periods - that hasn't been received/accounted for yet. This will cause the cache to,not
locust/locust/stats.py,439,"lag behind a second or two, but since StatsEntry.current_response_time_percentile()",not
locust/locust/stats.py,440,(which is what the response times cache is used for) uses an approximation of the,not
locust/locust/stats.py,441,"last 10 seconds anyway, it should be fine to ignore this.",not
locust/locust/stats.py,536,"First, we want to determine which of the cached response_times dicts we should",not
locust/locust/stats.py,537,use to get response_times for approximately 10 seconds ago.,not
locust/locust/stats.py,539,Since we can't be sure that the cache contains an entry for every second.,not
locust/locust/stats.py,540,We'll construct a list of timestamps which we consider acceptable keys to be used,not
locust/locust/stats.py,541,when trying to fetch the cached response_times. We construct this list in such a way,not
locust/locust/stats.py,542,"that it's ordered by preference by starting to add t-10, then t-11, t-9, t-12, t-8,",not
locust/locust/stats.py,543,and so on,not
locust/locust/stats.py,557,"If we fond an acceptable cached response times, we'll calculate a new response",not
locust/locust/stats.py,558,times dict of the last 10 seconds (approximately) by diffing it with the current,not
locust/locust/stats.py,559,total response times. Then we'll use that to calculate a response time percentile,not
locust/locust/stats.py,560,for that timeframe,not
locust/locust/stats.py,595,We'll use a cache size of CURRENT_RESPONSE_TIME_PERCENTILE_WINDOW + 10 since - in the extreme case -,not
locust/locust/stats.py,596,we might still use response times (from the cache) for t-CURRENT_RESPONSE_TIME_PERCENTILE_WINDOW-10,not
locust/locust/stats.py,597,"to calculate the current response time percentile, if we're missing cached values for the subsequent",not
locust/locust/stats.py,598,20 seconds,not
locust/locust/stats.py,602,only keep the latest 20 response_times dicts,not
locust/locust/user/users.py,25,gather any tasks that is declared on the class (or it's bases),not
locust/locust/user/users.py,30,Not a base class,not
locust/locust/user/users.py,33,check if class uses deprecated task_set attribute,not
locust/locust/user/users.py,128,"run the task_set on_start method, if it has one",not
locust/locust/user/users.py,133,"run the on_stop method, if it has one",not
locust/locust/user/task.py,241,"if this class doesn't have a min_wait, max_wait or wait_function defined, copy it from Locust",not
locust/locust/user/task.py,306,"check if the function is a method bound to the current locust, and if so, don't pass self as first argument",not
locust/locust/user/task.py,308,task is a bound method on self,not
locust/locust/user/task.py,311,task is another (nested) TaskSet class,not
locust/locust/user/task.py,314,task is a function,not
locust/locust/user/task.py,411,task is  (nested) TaskSet class,not
locust/locust/user/task.py,414,task is a function,not
locust/locust/user/inspectuser.py,33,get percentage,not
locust/locust/user/sequential_taskset.py,16,first get tasks from base classes,not
locust/locust/user/sequential_taskset.py,21,we want to insert tasks from the tasks attribute at the point of it's declaration,not
locust/locust/user/sequential_taskset.py,22,compared to methods declared with @task,not
locust/locust/user/sequential_taskset.py,29,method decorated with @task,not
locust/locust/contrib/fasthttp.py,6,some methods take a named parameter called json,not
locust/locust/contrib/fasthttp.py,23,Monkey patch geventhttpclient.useragent.CompatRequest so that Cookiejar works with Python >= 3.3,not
locust/locust/contrib/fasthttp.py,24,More info: https://github.com/requests/requests/pull/871,not
locust/locust/contrib/fasthttp.py,27,Workaround for AttributeError: 'CompatRequest' object has no attribute 'type' in Cookiejar,SATD
locust/locust/contrib/fasthttp.py,28,https://github.com/locustio/locust/issues/1138,not
locust/locust/contrib/fasthttp.py,29,Might allow secure cookies over non-secure connections but that is a minor concern in a load testing tool,not
locust/locust/contrib/fasthttp.py,32,Regexp for checking if an absolute URL was specified,not
locust/locust/contrib/fasthttp.py,35,"List of exceptions that can be raised by geventhttpclient when sending an HTTP request,",not
locust/locust/contrib/fasthttp.py,36,and that should result in a Locust failure,not
locust/locust/contrib/fasthttp.py,69,Below are various UserAgent settings. Change these in your subclass to alter FastHttpUser's behaviour.,not
locust/locust/contrib/fasthttp.py,70,"It needs to be done before FastHttpUser is instantiated, changing them later will have no effect",not
locust/locust/contrib/fasthttp.py,133,Check for basic authentication,not
locust/locust/contrib/fasthttp.py,140,remove username and password from the base_url,not
locust/locust/contrib/fasthttp.py,142,store authentication header (we construct this by using _basic_auth_str() function from requests.auth),not
locust/locust/contrib/fasthttp.py,196,prepend url with hostname unless it's already an absolute URL,not
locust/locust/contrib/fasthttp.py,199,store meta data that is used when reporting the request to locust's statistics,not
locust/locust/contrib/fasthttp.py,201,set up pre_request hook for attaching meta data to the request object,not
locust/locust/contrib/fasthttp.py,225,"send request, and catch any exceptions",not
locust/locust/contrib/fasthttp.py,231,"get the length of the content, but if the argument stream is set to True, we take",not
locust/locust/contrib/fasthttp.py,232,"the size from the content-length header, in order to not trigger fetching of the body",not
locust/locust/contrib/fasthttp.py,238,Record the consumed time,not
locust/locust/contrib/fasthttp.py,239,"Note: This is intentionally placed after we record the content_size above, since",not
locust/locust/contrib/fasthttp.py,240,we'll then trigger fetching of the body (unless stream=True),not
locust/locust/contrib/fasthttp.py,384,copy data from response to this object,not
locust/locust/contrib/fasthttp.py,387,store reference to locust Environment,not
locust/locust/contrib/fasthttp.py,400,if the user has already manually marked this response as failure or success,not
locust/locust/contrib/fasthttp.py,401,we can ignore the default haviour of letting the response code determine the outcome,not
locust/locust/test/test_client.py,52,verify that the time reported includes the download time of the whole streamed response,not
locust/locust/test/test_client.py,56,"verify that response time does NOT include whole download time, when using stream=True",not
locust/locust/test/test_client.py,61,download the content of the streaming response (so we don't get an ugly exception in the log),not
locust/locust/test/test_tags.py,52,"when tagging taskset, its tasks recieve the tag",not
locust/locust/test/test_tags.py,56,tagging inner task receives both,not
locust/locust/test/test_tags.py,60,"when tagging nested taskset, its tasks receives both",not
locust/locust/test/test_tags.py,69,task is tagged without parens,not
locust/locust/test/test_tags.py,72,task is tagged with empty parens,not
locust/locust/test/test_web.py,1,-*- coding: utf-8 -*-,not
locust/locust/test/test_web.py,70,"Test that setting each hatch option individually populates the corresponding field in the html, and none of the others",not
locust/locust/test/test_web.py,97,one entry plus Aggregated,not
locust/locust/test/test_web.py,112,one entry plus Aggregated,not
locust/locust/test/test_web.py,114,add another entry,not
locust/locust/test/test_web.py,117,old value should be cached now,not
locust/locust/test/test_web.py,122,this should no longer be cached,not
locust/locust/test/test_web.py,344,Suppress only the single warning from urllib3 needed.,not
locust/locust/test/test_locust_class.py,116,check that the User can be run,not
locust/locust/test/test_locust_class.py,479,stop User gracefully,not
locust/locust/test/test_locust_class.py,482,make sure instance is not killed right away,not
locust/locust/test/test_locust_class.py,486,check that locust instance has now died and that the task got to finish,not
locust/locust/test/test_locust_class.py,507,stop User gracefully,not
locust/locust/test/test_locust_class.py,510,"make sure instance is killed right away, and that the task did NOT get to finish",not
locust/locust/test/test_fasthttp.py,51,verify that the time reported includes the download time of the whole streamed response,not
locust/locust/test/test_fasthttp.py,55,"verify that response time does NOT include whole download time, when using stream=True",not
locust/locust/test/test_fasthttp.py,60,download the content of the streaming response (so we don't get an ugly exception in the log),not
locust/locust/test/test_fasthttp.py,353,"max_redirects and max_retries are funny names, because they are actually max attempts",not
locust/locust/test/test_fasthttp.py,366,ensure redirect still works,not
locust/locust/test/test_runners.py,88,Construct a {UserClass => count} dict from a list of user classes,not
locust/locust/test/test_runners.py,343,start a Master runner,not
locust/locust/test/test_runners.py,347,start 3 Worker runners,not
locust/locust/test/test_runners.py,354,give workers time to connect,not
locust/locust/test/test_runners.py,356,issue start command that should trigger TestUsers to be spawned in the Workers,not
locust/locust/test/test_runners.py,359,check that slave nodes have started locusts,not
locust/locust/test/test_runners.py,362,"give time for users to generate stats, and stats to be sent to master",not
locust/locust/test/test_runners.py,365,make sure users are killed,not
locust/locust/test/test_runners.py,369,check that stats are present in master,not
locust/locust/test/test_runners.py,450,print(master.clients['fake_client'].__dict__),not
locust/locust/test/test_runners.py,582,"let 10 second pass, do some more requests, send it to the master and make",not
locust/locust/test/test_runners.py,583,sure the current response time percentiles only accounts for these new requests,not
locust/locust/test/test_runners.py,610,let another worker connect,not
locust/locust/test/test_runners.py,654,change number of users and check that test_start isn't fired again,not
locust/locust/test/test_runners.py,658,stop and start to make sure test_start is fired again,not
locust/locust/test/test_runners.py,777,"start a new swarming in Step Load mode: total locust count of 10, hatch rate of 2, step locust count of 5, step duration of 2s",not
locust/locust/test/test_runners.py,780,make sure the first step run is started,not
locust/locust/test/test_runners.py,791,make sure the first step run is complete,not
locust/locust/test/test_runners.py,841,set config to catch exceptions in locust users,not
locust/locust/test/test_runners.py,847,make sure HeyAnException isn't raised,not
locust/locust/test/test_runners.py,850,make sure we got two entries in the error log,not
locust/locust/test/test_runners.py,853,make sure exception was stored,not
locust/locust/test/test_runners.py,877,self._report_to_master_event_handlers = [h for h in events.report_to_master._handlers],not
locust/locust/test/test_runners.py,880,events.report_to_master._handlers = self._report_to_master_event_handlers,not
locust/locust/test/test_runners.py,914,"print(""outbox:"", client.outbox)",not
locust/locust/test/test_runners.py,915,wait for worker to hatch locusts,not
locust/locust/test/test_runners.py,919,check that locust has started running,not
locust/locust/test/test_runners.py,922,send stop message,not
locust/locust/test/test_runners.py,925,check that locust user got to finish,not
locust/locust/test/test_runners.py,927,make sure the test_start was never fired on the worker,not
locust/locust/test/test_runners.py,951,"print(""outbox:"", client.outbox)",not
locust/locust/test/test_runners.py,952,wait for worker to hatch locusts,not
locust/locust/test/test_runners.py,956,check that locust has started running,not
locust/locust/test/test_runners.py,959,send stop message,not
locust/locust/test/test_runners.py,962,check that locust user did not get to finish,not
locust/locust/test/test_runners.py,1012,should only run when run time + stop_timeout is > short_time,not
locust/locust/test/test_runners.py,1014,should only run when run time + stop_timeout is > short_time * 2,not
locust/locust/test/test_runners.py,1027,exit with timeout,not
locust/locust/test/test_runners.py,1035,"allow task iteration to complete, with some margin",not
locust/locust/test/test_runners.py,1092,sleep to make sure locust has had time to start waiting,not
locust/locust/test/test_runners.py,1169,should only run when run time + stop_timeout is > short_time,not
locust/locust/test/test_runners.py,1171,should only run when run time + stop_timeout is > short_time * 2,not
locust/locust/test/test_runners.py,1186,exit with timeout,not
locust/locust/test/test_runners.py,1195,"allow task iteration to complete, with some margin",not
locust/locust/test/test_parser.py,46,overridden,not
locust/locust/test/test_parser.py,75,check default arg,not
locust/locust/test/test_stats.py,164,(rounded 120) min,not
locust/locust/test/test_stats.py,165,(rounded 990) max,not
locust/locust/test/test_stats.py,166,(rounded 140),not
locust/locust/test/test_stats.py,167,(rounded 550),not
locust/locust/test/test_stats.py,168,(rounded 560),not
locust/locust/test/test_stats.py,169,(rounded 390),not
locust/locust/test/test_stats.py,170,(rounded 560),not
locust/locust/test/test_stats.py,171,(rounded 980),not
locust/locust/test/test_stats.py,222,(rounded 120) min,not
locust/locust/test/test_stats.py,228,(rounded 130) min,not
locust/locust/test/test_stats.py,233,reset stats,not
locust/locust/test/test_stats.py,248,reset stats,not
locust/locust/test/test_stats.py,282,check that headline contains same number of column as the value rows,not
locust/locust/test/test_stats.py,359,Failing test for: https://github.com/locustio/locust/issues/1315,not
locust/locust/test/test_stats.py,392,spawn a user every 0.2 second,not
