file path,line #,comment,satd
scrapy/scrapy/http/request/form.py,108,"If we get here, it means that either formname was None",not
scrapy/scrapy/http/request/form.py,109,or invalid,not
scrapy/scrapy/http/request/form.py,163,Match browser behaviour on simple select tag without options selected,not
scrapy/scrapy/http/request/form.py,164,And for select tags wihout options,not
scrapy/scrapy/http/request/form.py,168,This is a workround to bug in lxml fixed 2.3.1,SATD
scrapy/scrapy/http/request/form.py,169,fix https://github.com/lxml/lxml/commit/57f49eed82068a20da3db8f1b18ae00c1bab8b12#L1L1139,not
scrapy/scrapy/http/request/form.py,189,"If we don't have clickdata, we just use the first clickable element",not
scrapy/scrapy/http/request/form.py,194,"If clickdata is given, we compare it to the clickable elements to find a",not
scrapy/scrapy/http/request/form.py,195,"match. We first look to see if the number is specified in clickdata,",not
scrapy/scrapy/http/request/form.py,196,because that uniquely identifies the element,not
scrapy/scrapy/http/request/form.py,206,"We didn't find it, so now we build an XPath expression out of the other",not
scrapy/scrapy/http/request/form.py,207,"arguments, because they can be used as such",not
scrapy/scrapy/http/request/__init__.py,23,this one has to be set first,not
scrapy/scrapy/contracts/default.py,10,contracts,not
scrapy/scrapy/contracts/__init__.py,61,calculate request args,not
scrapy/scrapy/contracts/__init__.py,64,Don't filter requests to allow,not
scrapy/scrapy/contracts/__init__.py,65,testing different callbacks on the same URL.,not
scrapy/scrapy/contracts/__init__.py,74,check if all positional arguments are defined in kwargs,not
scrapy/scrapy/contracts/__init__.py,78,execute pre and post hooks in order,not
scrapy/scrapy/templates/project/module/spiders/__init__.py,1,This package will contain the spiders of your Scrapy project,not
scrapy/scrapy/templates/project/module/spiders/__init__.py,2,,not
scrapy/scrapy/templates/project/module/spiders/__init__.py,3,Please refer to the documentation for information on how to create and manage,not
scrapy/scrapy/templates/project/module/spiders/__init__.py,4,your spiders.,not
scrapy/scrapy/utils/curl.py,27,"`--compressed` argument is not safe to ignore, but it's included here",not
scrapy/scrapy/utils/curl.py,28,because the `HttpCompressionMiddleware` is enabled by default,not
scrapy/scrapy/utils/curl.py,63,"curl automatically prepends 'http' if the scheme is missing, but Request",not
scrapy/scrapy/utils/curl.py,64,needs the scheme to work,not
scrapy/scrapy/utils/ssl.py,7,The OpenSSL symbol is present since 1.1.1 but it's not currently supported in any version of pyOpenSSL.,not
scrapy/scrapy/utils/ssl.py,8,"Using the binding directly, as this code does, requires cryptography 2.4.",not
scrapy/scrapy/utils/ssl.py,17,from OpenSSL.crypto.X509Name.__repr__,not
scrapy/scrapy/utils/ssl.py,25,requires OpenSSL 1.0.2,not
scrapy/scrapy/utils/ssl.py,28,adapted from OpenSSL apps/s_cb.c::ssl_print_tmp_key(),not
scrapy/scrapy/utils/console.py,17,Always use .instace() to ensure _instance propagation to all parents,not
scrapy/scrapy/utils/console.py,18,this is needed for <TAB> completion works well for new imports,not
scrapy/scrapy/utils/console.py,19,and clear the instance to always have the fresh env,not
scrapy/scrapy/utils/console.py,20,on repeated breaks like with inspect_response(),not
scrapy/scrapy/utils/console.py,50,readline module is only available on unix systems,not
scrapy/scrapy/utils/console.py,55,noqa: F401,not
scrapy/scrapy/utils/console.py,76,"list, preference order of shells",not
scrapy/scrapy/utils/console.py,78,available embeddable shells,not
scrapy/scrapy/utils/console.py,83,"function test: run all setup code (imports),",not
scrapy/scrapy/utils/console.py,84,but dont fall into the shell,not
scrapy/scrapy/utils/console.py,101,raised when using exit() in python code.interact,not
scrapy/scrapy/utils/spider.py,28,this needs to be imported here until get rid of the spider manager,not
scrapy/scrapy/utils/spider.py,29,singleton in scrapy.spider.spiders,SATD
scrapy/scrapy/utils/conf.py,46,"BEGIN Backward compatibility for old (base, custom) call signature",not
scrapy/scrapy/utils/conf.py,53,END Backward compatibility,not
scrapy/scrapy/utils/conf.py,169,FEEDS setting should take precedence over the -o and -t CLI options,not
scrapy/scrapy/utils/test.py,50,assuming boto=2.2.2,not
scrapy/scrapy/utils/test.py,64,loads acl before it will be deleted,not
scrapy/scrapy/utils/markup.py,9,noqa: F401,not
scrapy/scrapy/utils/multipart.py,9,noqa: F401,not
scrapy/scrapy/utils/reqser.py,24,urls should be safe (safe_string_url),not
scrapy/scrapy/utils/reqser.py,77,func has no __self__,not
scrapy/scrapy/utils/reqser.py,83,We need to use __func__ to access the original,not
scrapy/scrapy/utils/reqser.py,84,function object because instance method objects,not
scrapy/scrapy/utils/reqser.py,85,are generated each time attribute is retrieved from,not
scrapy/scrapy/utils/reqser.py,86,instance.,not
scrapy/scrapy/utils/reqser.py,87,,not
scrapy/scrapy/utils/reqser.py,88,Reference: The standard type hierarchy,not
scrapy/scrapy/utils/reqser.py,89,https://docs.python.org/3/reference/datamodel.html,not
scrapy/scrapy/utils/log.py,84,Route warnings through python logging,not
scrapy/scrapy/utils/log.py,202,"NOTE: This also handles 'args' being an empty dict, that case doesn't",not
scrapy/scrapy/utils/log.py,203,play well in logger.log calls,not
scrapy/scrapy/utils/boto.py,8,noqa: F401,not
scrapy/scrapy/utils/response.py,65,XXX: this implementation is a bit dirty and could be improved,SATD
scrapy/scrapy/utils/engine.py,3,used in global tests code,not
scrapy/scrapy/utils/engine.py,4,noqa: F401,not
scrapy/scrapy/utils/python.py,259,not attributes given return False by default,not
scrapy/scrapy/utils/python.py,265,support callables like itemgetter,not
scrapy/scrapy/utils/python.py,271,all attributes equal,not
scrapy/scrapy/utils/python.py,322,Collecting weakreferences can take two collections on PyPy.,not
scrapy/scrapy/utils/misc.py,94,named group,not
scrapy/scrapy/utils/misc.py,96,full regex or numbered groups,not
scrapy/scrapy/utils/ossignal.py,24,Catch Ctrl-Break in windows,not
scrapy/scrapy/utils/defer.py,56,FIXME: Hack to avoid introspecting tracebacks. This to speed up,SATD
scrapy/scrapy/utils/defer.py,57,"processing of IgnoreRequest errors which are, by far, the most common",not
scrapy/scrapy/utils/defer.py,58,exception in Scrapy - see #125,SATD
scrapy/scrapy/utils/defer.py,125,workaround for Python before 3.5.3 not having asyncio.isfuture,SATD
scrapy/scrapy/utils/defer.py,137,"wrapping the coroutine directly into a Deferred, this doesn't work correctly with coroutines",not
scrapy/scrapy/utils/defer.py,138,"that use asyncio, e.g. ""await asyncio.sleep(1)""",not
scrapy/scrapy/utils/defer.py,141,"wrapping the coroutine into a Future and then into a Deferred, this requires AsyncioSelectorReactor",not
scrapy/scrapy/utils/defer.py,162,noqa: E722,not
scrapy/scrapy/utils/http.py,11,noqa: F401,not
scrapy/scrapy/utils/url.py,12,scrapy.utils.url was moved to w3lib.url and import * ensures this,SATD
scrapy/scrapy/utils/url.py,13,move doesn't break old code,not
scrapy/scrapy/utils/url.py,15,noqa: F401,not
scrapy/scrapy/utils/url.py,92,Note: this does not match Windows filepath,not
scrapy/scrapy/utils/deprecate.py,78,see https://www.python.org/dev/peps/pep-3119/#overloading-isinstance-and-issubclass,not
scrapy/scrapy/utils/deprecate.py,79,and https://docs.python.org/reference/datamodel.html#customizing-instance-and-subclass-checks,not
scrapy/scrapy/utils/deprecate.py,80,for implementation details,not
scrapy/scrapy/utils/deprecate.py,87,we should do the magic only if second `issubclass` argument,not
scrapy/scrapy/utils/deprecate.py,88,is the deprecated class itself - subclasses of the,not
scrapy/scrapy/utils/deprecate.py,89,deprecated class should not use custom `__subclasscheck__`,not
scrapy/scrapy/utils/deprecate.py,90,method.,not
scrapy/scrapy/utils/deprecate.py,115,Sometimes inspect.stack() fails (e.g. when the first import of,not
scrapy/scrapy/utils/deprecate.py,116,deprecated class is in jinja2 template). __module__ attribute is not,not
scrapy/scrapy/utils/deprecate.py,117,important enough to raise an exception as users may be unable,not
scrapy/scrapy/utils/deprecate.py,118,to fix inspect.stack() errors.,not
scrapy/scrapy/utils/datatypes.py,103,"key is not weak-referenceable, skip caching",not
scrapy/scrapy/utils/datatypes.py,109,"key is not weak-referenceable, it's not cached",not
scrapy/scrapy/utils/gz.py,9,- Python>=3.5 GzipFile's read() has issues returning leftover,not
scrapy/scrapy/utils/gz.py,10,uncompressed data when input is corrupted,not
scrapy/scrapy/utils/gz.py,11,(regression or bug-fix compared to Python 3.4),not
scrapy/scrapy/utils/gz.py,12,"- read1(), which fetches data before raising EOFError on next call",not
scrapy/scrapy/utils/gz.py,13,works here but is only available from Python>=3.3,not
scrapy/scrapy/utils/gz.py,32,"complete only if there is some data, otherwise re-raise",not
scrapy/scrapy/utils/gz.py,33,see issue 87 about catching struct.error,not
scrapy/scrapy/utils/gz.py,34,some pages are quite small so output_list is empty and f.extrabuf,not
scrapy/scrapy/utils/gz.py,35,contains the whole page content,not
scrapy/scrapy/utils/testproc.py,11,trial chdirs to temp dir,not
scrapy/scrapy/core/scheduler.py,122,non serializable request,not
scrapy/scrapy/core/engine.py,28,requests in progress,not
scrapy/scrapy/core/engine.py,99,Will also close spiders and downloader,not
scrapy/scrapy/core/engine.py,102,Will also close downloader,not
scrapy/scrapy/core/engine.py,175,"downloader middleware can return requests (for example, redirects)",not
scrapy/scrapy/core/engine.py,179,response is a Response or Failure,not
scrapy/scrapy/core/engine.py,188,scraper is not idle,SATD
scrapy/scrapy/core/engine.py,192,downloader has pending requests,not
scrapy/scrapy/core/engine.py,196,not all start requests are handled,not
scrapy/scrapy/core/engine.py,200,scheduler has pending requests,not
scrapy/scrapy/core/engine.py,246,tie request to response received,not
scrapy/scrapy/core/scraper.py,132,returns spider's processed output,not
scrapy/scrapy/core/spidermw.py,74,don't handle _InvalidOutput exception,not
scrapy/scrapy/core/spidermw.py,83,stop exception handling by handing control over to the,not
scrapy/scrapy/core/spidermw.py,84,process_spider_output chain if an iterable has been returned,not
scrapy/scrapy/core/spidermw.py,94,items in this iterable do not need to go through the process_spider_output,not
scrapy/scrapy/core/spidermw.py,95,"chain, they went through it already from the process_spider_exception method",not
scrapy/scrapy/core/spidermw.py,103,might fail directly if the output value is not a generator,not
scrapy/scrapy/core/downloader/__init__.py,140,Delay queue processing if a download_delay is configured,not
scrapy/scrapy/core/downloader/__init__.py,149,Process enqueued requests if there are free slots to transfer for this slot,not
scrapy/scrapy/core/downloader/__init__.py,155,prevent burst if inter-request delays were configured,not
scrapy/scrapy/core/downloader/__init__.py,161,The order is very important for the following deferreds. Do not change!,not
scrapy/scrapy/core/downloader/__init__.py,163,1. Create the download deferred,not
scrapy/scrapy/core/downloader/__init__.py,166,2. Notify response_downloaded listeners about the recent download,not
scrapy/scrapy/core/downloader/__init__.py,167,before querying queue for next request,not
scrapy/scrapy/core/downloader/__init__.py,176,"3. After response arrives, remove the request from transferring",not
scrapy/scrapy/core/downloader/__init__.py,177,state to free up the transferring slot so it can be used by the,not
scrapy/scrapy/core/downloader/__init__.py,178,following requests (perhaps those which came from the downloader,not
scrapy/scrapy/core/downloader/__init__.py,179,middleware itself),not
scrapy/scrapy/core/downloader/contextfactory.py,38,setting verify=True will require you to provide CAs,not
scrapy/scrapy/core/downloader/contextfactory.py,39,to verify against; in other words: it's not that simple,not
scrapy/scrapy/core/downloader/contextfactory.py,41,backward-compatible SSL/TLS method:,not
scrapy/scrapy/core/downloader/contextfactory.py,42,,not
scrapy/scrapy/core/downloader/contextfactory.py,43,* this will respect `method` attribute in often recommended,not
scrapy/scrapy/core/downloader/contextfactory.py,44,`ScrapyClientContextFactory` subclass,SATD
scrapy/scrapy/core/downloader/contextfactory.py,45,(https://github.com/scrapy/scrapy/issues/1429#issuecomment-131782133),SATD
scrapy/scrapy/core/downloader/contextfactory.py,46,,not
scrapy/scrapy/core/downloader/contextfactory.py,47,* getattr() for `_ssl_method` attribute for context factories,not
scrapy/scrapy/core/downloader/contextfactory.py,48,"not calling super(..., self).__init__",not
scrapy/scrapy/core/downloader/contextfactory.py,55,"kept for old-style HTTP/1.0 downloader context twisted calls,",not
scrapy/scrapy/core/downloader/contextfactory.py,56,e.g. connectSSL(),not
scrapy/scrapy/core/downloader/contextfactory.py,85,trustRoot set to platformTrust() will use the platform's root CAs.,not
scrapy/scrapy/core/downloader/contextfactory.py,86,,not
scrapy/scrapy/core/downloader/contextfactory.py,87,This means that a website like https://www.cacert.org will be rejected,not
scrapy/scrapy/core/downloader/contextfactory.py,88,"by default, since CAcert.org CA certificate is seldom shipped.",not
scrapy/scrapy/core/downloader/tls.py,23,protocol negotiation (recommended),not
scrapy/scrapy/core/downloader/tls.py,24,SSL 3 (NOT recommended),not
scrapy/scrapy/core/downloader/tls.py,25,TLS 1.0 only,not
scrapy/scrapy/core/downloader/tls.py,26,TLS 1.1 only,not
scrapy/scrapy/core/downloader/tls.py,27,TLS 1.2 only,not
scrapy/scrapy/core/downloader/tls.py,58,requires pyOPenSSL 0.15,not
scrapy/scrapy/core/downloader/tls.py,59,requires pyOPenSSL 16.0.0,not
scrapy/scrapy/core/downloader/webclient.py,15,"Assume parsed is urlparse-d from Request.url,",not
scrapy/scrapy/core/downloader/webclient.py,16,which was passed via safe_url_string and is ascii-only.,not
scrapy/scrapy/core/downloader/webclient.py,44,bucket for response headers,not
scrapy/scrapy/core/downloader/webclient.py,46,Method command,not
scrapy/scrapy/core/downloader/webclient.py,48,Headers,not
scrapy/scrapy/core/downloader/webclient.py,53,Body,not
scrapy/scrapy/core/downloader/webclient.py,86,transport cleanup needed for HTTPS connections,not
scrapy/scrapy/core/downloader/webclient.py,109,converting to bytes to comply to Twisted interface,not
scrapy/scrapy/core/downloader/webclient.py,119,Fixes Twisted 11.1.0+ support as HTTPClientFactory is expected,not
scrapy/scrapy/core/downloader/webclient.py,120,to have _disconnectedDeferred. See Twisted r32329.,not
scrapy/scrapy/core/downloader/webclient.py,121,As Scrapy implements it's own logic to handle redirects is not,SATD
scrapy/scrapy/core/downloader/webclient.py,122,needed to add the callback _waitForDisconnect.,not
scrapy/scrapy/core/downloader/webclient.py,123,Specifically this avoids the AttributeError exception when,not
scrapy/scrapy/core/downloader/webclient.py,124,clientConnectionFailed method is called.,not
scrapy/scrapy/core/downloader/webclient.py,129,set Host header based on url,not
scrapy/scrapy/core/downloader/webclient.py,132,set Content-Length based len of body,not
scrapy/scrapy/core/downloader/webclient.py,135,just in case a broken http/1.1 decides to keep connection alive,not
scrapy/scrapy/core/downloader/webclient.py,137,Content-Length must be specified in POST method even with no body,not
scrapy/scrapy/core/downloader/handlers/http11.py,47,try method-aware context factory,not
scrapy/scrapy/core/downloader/handlers/http11.py,56,use context factory defaults,not
scrapy/scrapy/core/downloader/handlers/http11.py,92,"closeCachedConnections will hang on network or server issues, so",not
scrapy/scrapy/core/downloader/handlers/http11.py,93,we'll manually timeout the deferred.,not
scrapy/scrapy/core/downloader/handlers/http11.py,94,,not
scrapy/scrapy/core/downloader/handlers/http11.py,95,Twisted issue addressing this problem can be found here:,not
scrapy/scrapy/core/downloader/handlers/http11.py,96,https://twistedmatrix.com/trac/ticket/7738.,not
scrapy/scrapy/core/downloader/handlers/http11.py,97,,not
scrapy/scrapy/core/downloader/handlers/http11.py,98,"closeCachedConnections doesn't handle external errbacks, so we'll",not
scrapy/scrapy/core/downloader/handlers/http11.py,99,issue a callback after `_disconnect_timeout` seconds.,not
scrapy/scrapy/core/downloader/handlers/http11.py,150,make sure that enough (all) bytes are consumed,not
scrapy/scrapy/core/downloader/handlers/http11.py,151,and that we've got all HTTP headers (ending with a blank line),not
scrapy/scrapy/core/downloader/handlers/http11.py,152,from the proxy so that we don't send those bytes to the TLS layer,not
scrapy/scrapy/core/downloader/handlers/http11.py,153,,not
scrapy/scrapy/core/downloader/handlers/http11.py,154,see https://github.com/scrapy/scrapy/issues/2491,SATD
scrapy/scrapy/core/downloader/handlers/http11.py,160,set proper Server Name Indication extension,not
scrapy/scrapy/core/downloader/handlers/http11.py,233,proxy host and port are required for HTTP pool `key`,not
scrapy/scrapy/core/downloader/handlers/http11.py,234,"otherwise, same remote host connection request could reuse",not
scrapy/scrapy/core/downloader/handlers/http11.py,235,a cached tunneled connection to a different proxy,not
scrapy/scrapy/core/downloader/handlers/http11.py,263,"Cache *all* connections under the same key, since we are only",not
scrapy/scrapy/core/downloader/handlers/http11.py,264,"connecting to a single destination, the proxy:",not
scrapy/scrapy/core/downloader/handlers/http11.py,342,request details,not
scrapy/scrapy/core/downloader/handlers/http11.py,354,set download latency,not
scrapy/scrapy/core/downloader/handlers/http11.py,356,response body is ready to be consumed,not
scrapy/scrapy/core/downloader/handlers/http11.py,359,check download timeout,not
scrapy/scrapy/core/downloader/handlers/http11.py,368,"needed for HTTPS requests, otherwise _ResponseReader doesn't",not
scrapy/scrapy/core/downloader/handlers/http11.py,369,receive connectionLost(),not
scrapy/scrapy/core/downloader/handlers/http11.py,380,deliverBody hangs for responses without body,not
scrapy/scrapy/core/downloader/handlers/http11.py,410,Abort connection immediately.,not
scrapy/scrapy/core/downloader/handlers/http11.py,426,save response for timeouts,not
scrapy/scrapy/core/downloader/handlers/http11.py,489,This maybe called several times after cancel was called with buffered data.,not
scrapy/scrapy/core/downloader/handlers/http11.py,509,Clear buffer earlier to avoid keeping data in memory for a long time.,not
scrapy/scrapy/core/downloader/handlers/s3.py,25,noqa: F401,not
scrapy/scrapy/core/downloader/handlers/s3.py,45,"If no credentials could be found anywhere,",not
scrapy/scrapy/core/downloader/handlers/s3.py,46,consider this an anonymous connection request by default;,not
scrapy/scrapy/core/downloader/handlers/s3.py,47,unless 'anon' was set explicitly (True/False).,not
scrapy/scrapy/core/downloader/handlers/__init__.py,21,stores acceptable schemes on instancing,not
scrapy/scrapy/core/downloader/handlers/__init__.py,22,stores instanced handlers for schemes,not
scrapy/scrapy/core/downloader/handlers/__init__.py,23,remembers failed handlers,not
scrapy/scrapy/loader/__init__.py,46,values from initial item,not
scrapy/scrapy/settings/__init__.py,440,Do not pass kwarg values here. We don't want to promote user-defined,not
scrapy/scrapy/settings/__init__.py,441,"dicts, and we want to update, not replace, default dicts with the",not
scrapy/scrapy/settings/__init__.py,442,values given by the user,not
scrapy/scrapy/settings/__init__.py,445,Promote default dictionaries to BaseSettings instances for per-key,not
scrapy/scrapy/settings/__init__.py,446,priorities,not
scrapy/scrapy/settings/default_settings.py,76,3mins,not
scrapy/scrapy/settings/default_settings.py,78,1024m,not
scrapy/scrapy/settings/default_settings.py,79,32m,not
scrapy/scrapy/settings/default_settings.py,88,"Use highest TLS/SSL protocol version supported by the platform, also allowing negotiation:",not
scrapy/scrapy/settings/default_settings.py,95,Engine side,not
scrapy/scrapy/settings/default_settings.py,110,Downloader side,not
scrapy/scrapy/settings/default_settings.py,137,a function to extend uri arguments,not
scrapy/scrapy/settings/default_settings.py,215,enable memory debugging,not
scrapy/scrapy/settings/default_settings.py,216,send memory debugging report by mail at engine shutdown,not
scrapy/scrapy/settings/default_settings.py,235,uses Firefox default setting,not
scrapy/scrapy/settings/default_settings.py,242,initial response + 2 retries = 3 requests,not
scrapy/scrapy/settings/default_settings.py,263,Engine side,not
scrapy/scrapy/settings/default_settings.py,269,Spider side,not
scrapy/scrapy/spiders/sitemap.py,74,actual gzipped sitemap files are decompressed above ;,not
scrapy/scrapy/spiders/sitemap.py,75,if we are here (response body is not gzipped),not
scrapy/scrapy/spiders/sitemap.py,76,"and have a response for .xml.gz,",not
scrapy/scrapy/spiders/sitemap.py,77,it usually means that it was already gunzipped,not
scrapy/scrapy/spiders/sitemap.py,78,"by HttpCompression middleware,",not
scrapy/scrapy/spiders/sitemap.py,79,"the HTTP response being sent with ""Content-Encoding: gzip""",not
scrapy/scrapy/spiders/sitemap.py,80,"without actually being a .xml.gz file in the first place,",not
scrapy/scrapy/spiders/sitemap.py,81,"merely XML gzip-compressed on the fly,",not
scrapy/scrapy/spiders/sitemap.py,82,"in other word, here, we have plain XML",not
scrapy/scrapy/spiders/sitemap.py,97,"Also consider alternate URLs (xhtml:link rel=""alternate"")",not
scrapy/scrapy/spiders/feed.py,47,backward compatibility,not
scrapy/scrapy/spiders/feed.py,103,"When this is None, python's csv module's default delimiter is used",not
scrapy/scrapy/spiders/feed.py,104,"When this is None, python's csv module's default quotechar is used",not
scrapy/scrapy/spiders/__init__.py,112,Top-level imports,not
scrapy/scrapy/spiders/__init__.py,113,noqa: F401,not
scrapy/scrapy/spiders/__init__.py,114,noqa: F401,not
scrapy/scrapy/spiders/__init__.py,115,noqa: F401,not
scrapy/scrapy/linkextractors/htmlparser.py,57,wrapper needed to allow to work directly with text,not
scrapy/scrapy/linkextractors/sgml.py,71,wrapper needed to allow to work directly with text,not
scrapy/scrapy/linkextractors/lxmlhtml.py,19,from lxml/src/lxml/html/__init__.py,not
scrapy/scrapy/linkextractors/lxmlhtml.py,63,hacky way to get the underlying lxml parsed document,SATD
scrapy/scrapy/linkextractors/lxmlhtml.py,65,pseudo lxml.html.HtmlElement.make_links_absolute(base_url),not
scrapy/scrapy/linkextractors/lxmlhtml.py,71,skipping bogus links,not
scrapy/scrapy/linkextractors/lxmlhtml.py,77,to fix relative links after process_value,not
scrapy/scrapy/linkextractors/__init__.py,22,common file extensions that are not followed if they occur in links,not
scrapy/scrapy/linkextractors/__init__.py,24,archives,not
scrapy/scrapy/linkextractors/__init__.py,27,images,not
scrapy/scrapy/linkextractors/__init__.py,31,audio,not
scrapy/scrapy/linkextractors/__init__.py,34,video,not
scrapy/scrapy/linkextractors/__init__.py,38,office suites,not
scrapy/scrapy/linkextractors/__init__.py,42,other,not
scrapy/scrapy/linkextractors/__init__.py,135,Top-level imports,not
scrapy/scrapy/linkextractors/__init__.py,136,noqa: F401,not
scrapy/scrapy/extensions/feedexport.py,97,BEGIN Backward compatibility for initialising without keys (and,not
scrapy/scrapy/extensions/feedexport.py,98,without using from_crawler),not
scrapy/scrapy/extensions/feedexport.py,113,END Backward compatibility,not
scrapy/scrapy/extensions/feedexport.py,119,"remove first ""/""",not
scrapy/scrapy/extensions/feedexport.py,187,feed params,not
scrapy/scrapy/extensions/feedexport.py,191,flags,not
scrapy/scrapy/extensions/feedexport.py,225,Begin: Backward compatibility for FEED_URI and FEED_FORMAT settings,not
scrapy/scrapy/extensions/feedexport.py,232,handle pathlib.Path objects,not
scrapy/scrapy/extensions/feedexport.py,235,End: Backward compatibility for FEED_URI and FEED_FORMAT settings,not
scrapy/scrapy/extensions/feedexport.py,237,'FEEDS' setting takes precedence over 'FEED_URI',not
scrapy/scrapy/extensions/feedexport.py,239,handle pathlib.Path objects,not
scrapy/scrapy/extensions/feedexport.py,271,We need to call slot.storage.store nonetheless to get the file,not
scrapy/scrapy/extensions/feedexport.py,272,properly closed.,not
scrapy/scrapy/extensions/memusage.py,28,stdlib's resource module is only available on unix platforms.,not
scrapy/scrapy/extensions/memusage.py,50,"on macOS ru_maxrss is in bytes, on Linux it is in KB",not
scrapy/scrapy/extensions/memusage.py,97,warn only once,not
scrapy/scrapy/extensions/httpcache.py,44,one year,not
scrapy/scrapy/extensions/httpcache.py,67,"obey user-agent directive ""Cache-Control: no-store""",not
scrapy/scrapy/extensions/httpcache.py,70,Any other is eligible for caching,not
scrapy/scrapy/extensions/httpcache.py,74,What is cacheable - https://www.w3.org/Protocols/rfc2616/rfc2616-sec14.html#sec14.9.1,not
scrapy/scrapy/extensions/httpcache.py,75,Response cacheability - https://www.w3.org/Protocols/rfc2616/rfc2616-sec13.html#sec13.4,not
scrapy/scrapy/extensions/httpcache.py,76,Status code 206 is not included because cache can not deal with partial contents,not
scrapy/scrapy/extensions/httpcache.py,78,"obey directive ""Cache-Control: no-store""",not
scrapy/scrapy/extensions/httpcache.py,81,Never cache 304 (Not Modified) responses,not
scrapy/scrapy/extensions/httpcache.py,84,Cache unconditionally if configured to do so,not
