file path,line #,comment,satd
scrapy/conftest.py,11,"not a test, but looks like a test",not
scrapy/conftest.py,13,contains scripts to be run by tests/test_crawler.py::CrawlerProcessSubprocess,not
scrapy/conftest.py,15,contains scripts to be run by tests/test_crawler.py::CrawlerRunnerSubprocess,not
scrapy/conftest.py,17,Py36-only parts of respective tests,not
scrapy/conftest.py,34,Avoid executing tests when executing `--flake8` flag (pytest-flake8),not
scrapy/conftest.py,46,doctests,not
scrapy/extras/qps-bench-server.py,1,!/usr/bin/env python,not
scrapy/extras/qps-bench-server.py,28,reset stats on high iter-request times caused by client restarts,not
scrapy/extras/qps-bench-server.py,29,seconds,not
scrapy/extras/qpsclient.py,19,Max concurrency is limited by global CONCURRENT_REQUESTS setting,not
scrapy/extras/qpsclient.py,21,Requests per second goal,not
scrapy/extras/qpsclient.py,22,same as: 1 / download_delay,not
scrapy/extras/qpsclient.py,24,time in seconds to delay server responses,not
scrapy/extras/qpsclient.py,26,number of slots to create,not
scrapy/tests/test_utils_url.py,242,some corner cases (default to http://),not
scrapy/tests/test_utils_url.py,252,TODO: the following tests do not pass with current implementation,SATD
scrapy/tests/test_utils_url.py,316,"user: ""username@""",not
scrapy/tests/test_utils_url.py,317,password: none,not
scrapy/tests/test_utils_url.py,321,"user: ""username:pass""",not
scrapy/tests/test_utils_url.py,322,"password: """"",not
scrapy/tests/test_utils_url.py,326,"user: ""me""",not
scrapy/tests/test_utils_url.py,327,"password: ""user@domain.com""",not
scrapy/tests/test_utils_asyncio.py,12,the result should depend only on the pytest --reactor argument,not
scrapy/tests/test_utils_asyncio.py,16,this should do nothing,not
scrapy/tests/test_commands.py,155,only pass one argument. spider script shouldn't be created,not
scrapy/tests/test_commands.py,158,pass two arguments <name> <domain>. spider script should be created,not
scrapy/tests/test_commands.py,262,see https://github.com/scrapy/scrapy/issues/2811,SATD
scrapy/tests/test_commands.py,263,"The spider below should not be able to connect to localhost:12345,",not
scrapy/tests/test_commands.py,264,"which is intended,",not
scrapy/tests/test_commands.py,265,but this should not be because of DNS lookup error,not
scrapy/tests/test_commands.py,266,assumption: localhost will resolve in all cases (true?),not
scrapy/tests/test_downloadermiddleware_redirect.py,35,response without Location header but with status code is 3XX should be ignored,not
scrapy/tests/test_downloadermiddleware_redirect.py,61,Test that it redirects when dont_redirect is False,not
scrapy/tests/test_downloadermiddleware_redirect.py,87,response without Location header but with status code is 3XX should be ignored,not
scrapy/tests/test_downloadermiddleware_redirect.py,102,response without Location header but with status code is 3XX should be ignored,not
scrapy/tests/test_downloadermiddleware_redirect.py,118,response without Location header but with status code is 3XX should be ignored,not
scrapy/tests/test_downloadermiddleware_redirect.py,187,HTTP historically supports latin1,not
scrapy/tests/test_downloadermiddleware_redirect.py,195,header using UTF-8 encoding,not
scrapy/tests/test_downloadermiddleware_redirect.py,227,meta-refresh with high intervals don't trigger redirects,not
scrapy/tests/test_utils_python.py,115,no attributes given return False,not
scrapy/tests/test_utils_python.py,117,not existent attributes,not
scrapy/tests/test_utils_python.py,122,equal attribute,not
scrapy/tests/test_utils_python.py,126,obj1 has no attribute y,not
scrapy/tests/test_utils_python.py,130,equal attributes,not
scrapy/tests/test_utils_python.py,134,differente attributes,not
scrapy/tests/test_utils_python.py,137,test callable,not
scrapy/tests/test_utils_python.py,142,compare ['meta']['a'],not
scrapy/tests/test_utils_python.py,153,fail z equality,not
scrapy/tests/test_utils_python.py,210,TODO: how do we fix this to return the actual argument names?,SATD
scrapy/tests/test_spidermiddleware_referer.py,62,no credentials leak,not
scrapy/tests/test_spidermiddleware_referer.py,65,no referrer leak for local schemes,not
scrapy/tests/test_spidermiddleware_referer.py,69,no referrer leak for s3 origins,not
scrapy/tests/test_spidermiddleware_referer.py,87,TLS to TLS: send non-empty referrer,not
scrapy/tests/test_spidermiddleware_referer.py,94,TLS to non-TLS: do not send referrer,not
scrapy/tests/test_spidermiddleware_referer.py,99,non-TLS to TLS or non-TLS: send referrer,not
scrapy/tests/test_spidermiddleware_referer.py,109,test for user/password stripping,not
scrapy/tests/test_spidermiddleware_referer.py,116,"Same origin (protocol, host, port): send referrer",not
scrapy/tests/test_spidermiddleware_referer.py,124,Different host: do NOT send referrer,not
scrapy/tests/test_spidermiddleware_referer.py,129,Different port: do NOT send referrer,not
scrapy/tests/test_spidermiddleware_referer.py,134,Different protocols: do NOT send refferer,not
scrapy/tests/test_spidermiddleware_referer.py,141,test for user/password stripping,not
scrapy/tests/test_spidermiddleware_referer.py,149,"TLS or non-TLS to TLS or non-TLS: referrer origin is sent (yes, even for downgrades)",not
scrapy/tests/test_spidermiddleware_referer.py,155,test for user/password stripping,not
scrapy/tests/test_spidermiddleware_referer.py,162,TLS or non-TLS to TLS or non-TLS: referrer origin is sent but not for downgrades,not
scrapy/tests/test_spidermiddleware_referer.py,167,downgrade: send nothing,not
scrapy/tests/test_spidermiddleware_referer.py,170,upgrade: send origin,not
scrapy/tests/test_spidermiddleware_referer.py,173,test for user/password stripping,not
scrapy/tests/test_spidermiddleware_referer.py,181,"Same origin (protocol, host, port): send referrer",not
scrapy/tests/test_spidermiddleware_referer.py,189,Different host: send origin as referrer,not
scrapy/tests/test_spidermiddleware_referer.py,193,exact match required,not
scrapy/tests/test_spidermiddleware_referer.py,196,Different port: send origin as referrer,not
scrapy/tests/test_spidermiddleware_referer.py,200,Different protocols: send origin as referrer,not
scrapy/tests/test_spidermiddleware_referer.py,207,test for user/password stripping,not
scrapy/tests/test_spidermiddleware_referer.py,209,TLS to non-TLS downgrade: send origin,not
scrapy/tests/test_spidermiddleware_referer.py,216,"Same origin (protocol, host, port): send referrer",not
scrapy/tests/test_spidermiddleware_referer.py,224,Different host: send origin as referrer,not
scrapy/tests/test_spidermiddleware_referer.py,228,exact match required,not
scrapy/tests/test_spidermiddleware_referer.py,231,Different port: send origin as referrer,not
scrapy/tests/test_spidermiddleware_referer.py,235,downgrade,not
scrapy/tests/test_spidermiddleware_referer.py,239,non-TLS to non-TLS,not
scrapy/tests/test_spidermiddleware_referer.py,242,upgrade,not
scrapy/tests/test_spidermiddleware_referer.py,246,Different protocols: send origin as referrer,not
scrapy/tests/test_spidermiddleware_referer.py,250,test for user/password stripping,not
scrapy/tests/test_spidermiddleware_referer.py,253,TLS to non-TLS downgrade: send nothing,not
scrapy/tests/test_spidermiddleware_referer.py,260,TLS to TLS: send referrer,not
scrapy/tests/test_spidermiddleware_referer.py,268,"TLS to non-TLS: send referrer (yes, it's unsafe)",not
scrapy/tests/test_spidermiddleware_referer.py,273,"non-TLS to TLS or non-TLS: send referrer (yes, it's unsafe)",not
scrapy/tests/test_spidermiddleware_referer.py,283,test for user/password stripping,not
scrapy/tests/test_spidermiddleware_referer.py,293,--- Tests using settings to set policy using class path,not
scrapy/tests/test_spidermiddleware_referer.py,352,--- Tests using Request meta dict to set policy,not
scrapy/tests/test_spidermiddleware_referer.py,408,When an unknown policy is referenced in Request.meta,not
scrapy/tests/test_spidermiddleware_referer.py,409,"(here, a typo error),",not
scrapy/tests/test_spidermiddleware_referer.py,410,the policy defined in settings takes precedence,not
scrapy/tests/test_spidermiddleware_referer.py,418,same as above but with string value for settings policy,not
scrapy/tests/test_spidermiddleware_referer.py,426,"request meta references a wrong policy but it is set,",not
scrapy/tests/test_spidermiddleware_referer.py,427,"so the Referrer-Policy header in response is not used,",not
scrapy/tests/test_spidermiddleware_referer.py,428,and the settings' policy is applied,not
scrapy/tests/test_spidermiddleware_referer.py,436,"here, request meta does not set the policy",not
scrapy/tests/test_spidermiddleware_referer.py,437,so response headers take precedence,not
scrapy/tests/test_spidermiddleware_referer.py,445,"here, request meta does not set the policy,",not
scrapy/tests/test_spidermiddleware_referer.py,446,"but response headers also use an unknown policy,",not
scrapy/tests/test_spidermiddleware_referer.py,447,so the settings' policy is used,not
scrapy/tests/test_spidermiddleware_referer.py,545,parent,not
scrapy/tests/test_spidermiddleware_referer.py,546,target,not
scrapy/tests/test_spidermiddleware_referer.py,548,"redirections: code, URL",not
scrapy/tests/test_spidermiddleware_referer.py,552,expected initial referer,not
scrapy/tests/test_spidermiddleware_referer.py,553,expected referer for the redirection request,not
scrapy/tests/test_spidermiddleware_referer.py,559,redirecting to non-secure URL,not
scrapy/tests/test_spidermiddleware_referer.py,569,redirecting to non-secure URL: different origin,not
scrapy/tests/test_spidermiddleware_referer.py,609,parent,not
scrapy/tests/test_spidermiddleware_referer.py,610,target,not
scrapy/tests/test_spidermiddleware_referer.py,612,"redirections: code, URL",not
scrapy/tests/test_spidermiddleware_referer.py,616,"expected initial ""Referer""",not
scrapy/tests/test_spidermiddleware_referer.py,617,"expected ""Referer"" for the redirection request",not
scrapy/tests/test_spidermiddleware_referer.py,630,different origin,not
scrapy/tests/test_spidermiddleware_referer.py,651,origin,not
scrapy/tests/test_spidermiddleware_referer.py,652,target,not
scrapy/tests/test_spidermiddleware_referer.py,654,"redirections: code, URL",not
scrapy/tests/test_spidermiddleware_referer.py,658,"expected initial ""Referer""",not
scrapy/tests/test_spidermiddleware_referer.py,659,expected referer for the redirection request,not
scrapy/tests/test_spidermiddleware_referer.py,665,redirecting from secure to non-secure URL == different origin,not
scrapy/tests/test_spidermiddleware_referer.py,675,different domain == different origin,not
scrapy/tests/test_spidermiddleware_referer.py,702,send origin,not
scrapy/tests/test_spidermiddleware_referer.py,703,redirects to same origin: send origin,not
scrapy/tests/test_spidermiddleware_referer.py,709,redirecting to non-secure URL: no referrer,not
scrapy/tests/test_spidermiddleware_referer.py,719,redirecting to non-secure URL (different domain): no referrer,not
scrapy/tests/test_spidermiddleware_referer.py,738,"HTTPS all along, so origin referrer is kept as-is",not
scrapy/tests/test_spidermiddleware_referer.py,747,TLS to non-TLS: no referrer,not
scrapy/tests/test_spidermiddleware_referer.py,749,TLS URL again: (still) no referrer,not
scrapy/tests/test_spidermiddleware_referer.py,769,origin,not
scrapy/tests/test_spidermiddleware_referer.py,770,target + redirection,not
scrapy/tests/test_spidermiddleware_referer.py,772,"redirections: code, URL",not
scrapy/tests/test_spidermiddleware_referer.py,776,expected initial referer,not
scrapy/tests/test_spidermiddleware_referer.py,777,expected referer for the redirection request,not
scrapy/tests/test_spidermiddleware_referer.py,783,redirecting to non-secure URL: send origin,not
scrapy/tests/test_spidermiddleware_referer.py,793,redirecting to non-secure URL (different domain): send origin,not
scrapy/tests/test_spidermiddleware_referer.py,812,all different domains: send origin,not
scrapy/tests/test_spidermiddleware_referer.py,821,TLS to non-TLS: send origin,not
scrapy/tests/test_spidermiddleware_referer.py,823,TLS URL again: send origin (also),not
scrapy/tests/test_spidermiddleware_referer.py,845,origin,not
scrapy/tests/test_spidermiddleware_referer.py,846,target + redirection,not
scrapy/tests/test_spidermiddleware_referer.py,848,"redirections: code, URL",not
scrapy/tests/test_spidermiddleware_referer.py,852,expected initial referer,not
scrapy/tests/test_spidermiddleware_referer.py,853,expected referer for the redirection request,not
scrapy/tests/test_spidermiddleware_referer.py,859,"redirecting to non-secure URL: do not send the ""Referer"" header",not
scrapy/tests/test_spidermiddleware_referer.py,869,redirecting to non-secure URL (different domain): send origin,not
scrapy/tests/test_spidermiddleware_referer.py,888,all different domains: send origin,not
scrapy/tests/test_spidermiddleware_referer.py,897,"TLS to non-TLS: do not send ""Referer""",not
scrapy/tests/test_spidermiddleware_referer.py,899,TLS URL again: (still) send nothing,not
scrapy/tests/test_extension_telnet.py,17,This function has some side effects we don't need for this test,not
scrapy/tests/test_utils_request.py,19,make sure caching is working,not
scrapy/tests/test_utils_request.py,59,cached fingerprint must be cleared on request copy,not
scrapy/tests/test_utils_request.py,82,the representation is not important but it must not fail.,not
scrapy/tests/test_utils_log.py,69,disable it to avoid the extra warning,not
scrapy/tests/test_pipeline_crawl.py,63,prepare a directory for storing files,not
scrapy/tests/test_pipeline_crawl.py,90,check that logs show the expected number of successful file downloads,not
scrapy/tests/test_pipeline_crawl.py,94,check that the images/files checksums are what we know they should be,not
scrapy/tests/test_pipeline_crawl.py,103,check that the image files where actually written to the media store,not
scrapy/tests/test_pipeline_crawl.py,112,"check that the item does NOT have the ""images/files"" field populated",not
scrapy/tests/test_pipeline_crawl.py,117,check that there was 1 successful fetch and 3 other responses with non-200 code,not
scrapy/tests/test_pipeline_crawl.py,123,check that logs do show the failure on the file downloads,not
scrapy/tests/test_pipeline_crawl.py,127,check that no files were written to the media store,not
scrapy/tests/test_pipeline_crawl.py,180,somehow checksums for images are different for Python 3.3,not
scrapy/tests/test_scheduler.py,267,pylint: disable=protected-access,not
scrapy/tests/test_scheduler.py,274,pylint: disable=protected-access,not
scrapy/tests/test_utils_deprecate.py,109,ignore subclassing warnings,not
scrapy/tests/test_utils_deprecate.py,118,subclass instances don't warn,not
scrapy/tests/test_loader.py,12,test items,not
scrapy/tests/test_loader.py,31,test item loaders,not
scrapy/tests/test_loader.py,48,test processors,not
scrapy/tests/test_loader.py,75,Let's assume a SKU is only digits.,not
scrapy/tests/test_loader.py,80,take first which allows empty values,not
scrapy/tests/test_loader.py,89,"Should not return ""sku: None"".",not
scrapy/tests/test_loader.py,91,Should not ignore empty values.,not
scrapy/tests/test_loader.py,132,test add object value,not
scrapy/tests/test_loader.py,774,combining/accumulating CSS selectors and XPath expressions,not
scrapy/tests/test_loader.py,995,Functions as processors,not
scrapy/tests/test_utils_iterators.py,54,example taken from https://github.com/scrapy/scrapy/issues/1665,SATD
scrapy/tests/test_utils_iterators.py,92,with bytes,not
scrapy/tests/test_utils_iterators.py,94,Unicode body needs encoding information,not
scrapy/tests/test_utils_iterators.py,257,explicit type check cuz' we no like stinkin' autocasting! yarrr,not
scrapy/tests/test_downloadermiddleware_httpcompression.py,73,noqa: F401,not
scrapy/tests/test_downloadermiddleware_httpcompression.py,210,"build a gzipped file (here, a sitemap)",not
scrapy/tests/test_downloadermiddleware_httpcompression.py,231,build a gzipped response body containing this gzipped file,not
scrapy/tests/test_crawler.py,101,disable telnet if not available to avoid an extra warning,not
scrapy/tests/test_item.py,168,D class inverted,not
scrapy/tests/test_item.py,199,D class inverted,not
scrapy/tests/test_item.py,229,D class inverted,not
scrapy/tests/test_item.py,286,This attribute is an internal attribute in Python 3.6+,not
scrapy/tests/test_item.py,287,and must be propagated properly. See,not
scrapy/tests/test_item.py,288,https://docs.python.org/3.6/reference/datamodel.html#creating-the-class-object,not
scrapy/tests/test_item.py,289,"In <3.6, we add a dummy attribute just to ensure the",not
scrapy/tests/test_item.py,290,__new__ method propagates it correctly.,not
scrapy/tests/test_item.py,294,For rationale of this see:,not
scrapy/tests/test_item.py,295,https://github.com/python/cpython/blob/ee1a81b77444c6715cbe610e951c655b6adab88b/Lib/test/test_super.py#L222,not
scrapy/tests/test_item.py,296,noqa  https://github.com/scrapy/scrapy/issues/2836,SATD
scrapy/tests/test_item.py,313,This call to super() trigger the __classcell__ propagation,not
scrapy/tests/test_item.py,314,requirement. When not done properly raises an error:,not
scrapy/tests/test_item.py,315,TypeError: __class__ set to <class '__main__.MyItem'>,not
scrapy/tests/test_item.py,316,defining 'MyItem' as <class '__main__.MyItem'>,not
scrapy/tests/test_responsetypes.py,75,TODO: add more tests that check precedence between the different arguments,SATD
scrapy/tests/test_responsetypes.py,78,headers takes precedence over url,not
scrapy/tests/test_responsetypes.py,89,check that mime.types files shipped with scrapy are loaded,SATD
scrapy/tests/test_spider.py,434,.xml.gz but body decoded by HttpCompression middleware already,not
scrapy/tests/test_spider.py,599,spider without overridden make_requests_from_url method,not
scrapy/tests/test_spider.py,600,doesn't issue a warning,not
scrapy/tests/test_spider.py,605,spider without overridden make_requests_from_url method,not
scrapy/tests/test_spider.py,606,should issue a warning when called directly,not
scrapy/tests/test_spider.py,611,"spider with overridden make_requests_from_url issues a warning,",not
scrapy/tests/test_spider.py,612,but the method still works,not
scrapy/tests/test_robotstxt_interface.py,1,coding=utf-8,not
scrapy/tests/test_robotstxt_interface.py,6,check if reppy parser is installed,not
scrapy/tests/test_robotstxt_interface.py,8,noqa: F401,not
scrapy/tests/test_robotstxt_interface.py,15,check if robotexclusionrulesparser is installed,not
scrapy/tests/test_robotstxt_interface.py,17,noqa: F401,not
scrapy/tests/test_robotstxt_interface.py,24,check if protego parser is installed,not
scrapy/tests/test_robotstxt_interface.py,26,noqa: F401,not
scrapy/tests/test_mail.py,1,coding=utf-8,not
scrapy/tests/test_http_request.py,21,Request requires url in the __init__ method,not
scrapy/tests/test_http_request.py,24,url argument must be basestring,not
scrapy/tests/test_http_request.py,52,Different ways of setting headers attribute,not
scrapy/tests/test_http_request.py,62,headers must not be unicode,not
scrapy/tests/test_http_request.py,96,"encoding affects only query part of URI, not path",not
scrapy/tests/test_http_request.py,97,path part should always be UTF-8 encoded before percent-escaping,not
scrapy/tests/test_http_request.py,108,should be same as above,not
scrapy/tests/test_http_request.py,113,encoding is used for encoding query-string before percent-escaping;,not
scrapy/tests/test_http_request.py,114,path is still UTF-8 encoded before percent-escaping,not
scrapy/tests/test_http_request.py,119,percent-escaping sequences that do not match valid UTF-8 sequences,not
scrapy/tests/test_http_request.py,120,should be kept untouched (just upper-cased perhaps),not
scrapy/tests/test_http_request.py,121,,not
scrapy/tests/test_http_request.py,122,See https://tools.ietf.org/html/rfc3987#section-3.2,not
scrapy/tests/test_http_request.py,123,,not
scrapy/tests/test_http_request.py,124,"""Conversions from URIs to IRIs MUST NOT use any character encoding",not
scrapy/tests/test_http_request.py,125,"other than UTF-8 in steps 3 and 4, even if it might be possible to",not
scrapy/tests/test_http_request.py,126,guess from the context that another character encoding than UTF-8 was,not
scrapy/tests/test_http_request.py,127,"used in the URI.  For example, the URI",not
scrapy/tests/test_http_request.py,128,"""http://www.example.org/r%E9sum%E9.html"" might with some guessing be",not
scrapy/tests/test_http_request.py,129,interpreted to contain two e-acute characters encoded as iso-8859-1.,not
scrapy/tests/test_http_request.py,130,It must not be converted to an IRI containing these e-acute,not
scrapy/tests/test_http_request.py,131,"characters.  Otherwise, in the future the IRI will be mapped to",not
scrapy/tests/test_http_request.py,132,"""http://www.example.org/r%C3%A9sum%C3%A9.html"", which is a different",not
scrapy/tests/test_http_request.py,133,"URI from ""http://www.example.org/r%E9sum%E9.html"".",not
scrapy/tests/test_http_request.py,152,default encoding,not
scrapy/tests/test_http_request.py,163,ascii url,not
scrapy/tests/test_http_request.py,166,unicode url,not
scrapy/tests/test_http_request.py,182,make sure copy does not propagate callbacks,not
scrapy/tests/test_http_request.py,188,make sure flags list is shallow copied,not
scrapy/tests/test_http_request.py,192,make sure cb_kwargs dict is shallow copied,not
scrapy/tests/test_http_request.py,196,make sure meta dict is shallow copied,not
scrapy/tests/test_http_request.py,200,make sure headers attribute is shallow copied,not
scrapy/tests/test_http_request.py,206,Request.body can be identical since it's an immutable object (str),not
scrapy/tests/test_http_request.py,230,Empty attributes (which may fail if not compared properly),not
scrapy/tests/test_http_request.py,284,Note: more curated tests regarding curl conversion are in,not
scrapy/tests/test_http_request.py,285,`test_utils_curl.py`,not
scrapy/tests/test_http_request.py,341,By default: it works and ignores the unknown options: --foo and -z,not
scrapy/tests/test_http_request.py,342,avoid warning when executing tests,not
scrapy/tests/test_http_request.py,349,If `ignore_unknon_options` is set to `False` it raises an error with,not
scrapy/tests/test_http_request.py,350,the unknown options: --foo and -z,not
scrapy/tests/test_http_request.py,374,using default encoding (utf-8),not
scrapy/tests/test_http_request.py,383,using default encoding (utf-8),not
scrapy/tests/test_http_request.py,392,using default encoding (utf-8),not
scrapy/tests/test_http_request.py,415,using multiples values for a single key,not
scrapy/tests/test_http_request.py,617,xpath in _get_inputs(),not
scrapy/tests/test_http_request.py,618,xpath in _get_clickable(),not
scrapy/tests/test_http_request.py,1287,empty data,not
scrapy/tests/test_http_request.py,1292,data is not passed,not
scrapy/tests/test_http_request.py,1306,method passed explicitly,not
scrapy/tests/test_downloadermiddleware_useragent.py,23,settings UESR_AGENT to None should remove the user agent,not
scrapy/tests/test_webclient.py,15,deprecated in Twisted 19.7.0,not
scrapy/tests/test_webclient.py,16,(remove once we bump our requirement past that version),not
scrapy/tests/test_webclient.py,97,basic test stolen from twisted HTTPageGetter,not
scrapy/tests/test_webclient.py,119,test minimal sent headers,not
scrapy/tests/test_webclient.py,126,test a simple POST with body and content-type,not
scrapy/tests/test_webclient.py,142,test a POST method with no body provided,not
scrapy/tests/test_webclient.py,154,test with single and multivalued headers,not
scrapy/tests/test_webclient.py,171,same test with single and multivalued headers but using Headers class,not
scrapy/tests/test_webclient.py,199,regression test for: http://dev.scrapy.org/ticket/258,SATD
scrapy/tests/test_webclient.py,258,"if we pass Host header explicitly, it should be used, otherwise",not
scrapy/tests/test_webclient.py,259,it should extract from url,not
scrapy/tests/test_webclient.py,309,Clean up the server which is hanging around not doing,SATD
scrapy/tests/test_webclient.py,310,anything.,not
scrapy/tests/test_webclient.py,312,There might be nothing here if the server managed to already see,not
scrapy/tests/test_webclient.py,313,that the connection was lost.,not
scrapy/tests/test_webclient.py,398,we try to use a cipher that is not enabled by default in OpenSSL,not
scrapy/tests/test_utils_defer.py,18,it is [1] with maybeDeferred,not
scrapy/tests/test_utils_defer.py,19,"add another value, that should be catched by assertEqual",not
scrapy/tests/test_utils_defer.py,32,it is [1] with maybeDeferred,not
scrapy/tests/test_utils_defer.py,33,"add another value, that should be catched by assertEqual",not
scrapy/tests/test_squeues.py,33,Selectors should fail (lxml.html.HtmlElement objects can't be pickled),not
scrapy/tests/test_downloadermiddleware_httpproxy.py,67,proxy from request.meta,not
scrapy/tests/test_downloadermiddleware_httpproxy.py,80,proxy from request.meta,not
scrapy/tests/test_downloadermiddleware_httpproxy.py,87,utf-8 encoding,not
scrapy/tests/test_downloadermiddleware_httpproxy.py,95,proxy from request.meta,not
scrapy/tests/test_downloadermiddleware_httpproxy.py,101,default latin-1 encoding,not
scrapy/tests/test_downloadermiddleware_httpproxy.py,108,"proxy from request.meta, latin-1 encoding",not
scrapy/tests/test_downloadermiddleware_httpproxy.py,140,proxy from meta['proxy'] takes precedence,not
scrapy/tests/mockserver.py,41,silence CancelledError,not
scrapy/tests/mockserver.py,60,"order == ""desc""",not
scrapy/tests/mockserver.py,85,send headers now and delay body,not
scrapy/tests/mockserver.py,136,"we force the body content, otherwise Twisted redirectTo()",not
scrapy/tests/mockserver.py,137,"returns HTML with <meta http-equiv=""refresh""",not
scrapy/tests/mockserver.py,268,disabling TLS1.2+ because it unconditionally enables some strong ciphers,not
