file path,line #,comment,satd
scrapy/tests/test_downloader_handlers.py,1060,setup server for anonymous access,not
scrapy/tests/test_http_cookies.py,71,get_all result must be native string,not
scrapy/tests/test_downloadermiddleware_cookies.py,115,merge some cookies into jar,not
scrapy/tests/test_downloadermiddleware_cookies.py,121,test Cookie header is not seted to request,not
scrapy/tests/test_downloadermiddleware_cookies.py,126,check that returned cookies are not merged back to jar,not
scrapy/tests/test_downloadermiddleware_cookies.py,130,check that cookies are merged back,not
scrapy/tests/test_downloadermiddleware_cookies.py,135,check that cookies are merged when dont_merge_cookies is passed as 0,not
scrapy/tests/test_downloadermiddleware_cookies.py,141,merge some cookies into jar,not
scrapy/tests/test_downloadermiddleware_cookies.py,152,embed C1 and C3 for scrapytest.org/foo,SATD
scrapy/tests/test_downloadermiddleware_cookies.py,157,embed C2 for scrapytest.org/bar,SATD
scrapy/tests/test_downloadermiddleware_cookies.py,162,embed nothing for scrapytest.org/baz,SATD
scrapy/tests/test_downloadermiddleware_cookies.py,206,cookies from hosts with port,not
scrapy/tests/test_downloadermiddleware_cookies.py,222,skip cookie retrieval for not http request,not
scrapy/tests/test_linkextractors.py,14,a hack to skip base class tests in pytest,SATD
scrapy/tests/test_linkextractors.py,266,jpg is ignored by default,not
scrapy/tests/test_linkextractors.py,274,override denied extensions,not
scrapy/tests/test_linkextractors.py,494,Simple text inclusion test,not
scrapy/tests/test_linkextractors.py,499,Unique regex test,not
scrapy/tests/test_linkextractors.py,504,Multiple regex test,not
scrapy/tests/test_http_response.py,21,Response requires url in the consturctor,not
scrapy/tests/test_http_response.py,25,body can be str or None,not
scrapy/tests/test_http_response.py,28,test presence of all optional parameters,not
scrapy/tests/test_http_response.py,62,make sure flags list is shallow copied,not
scrapy/tests/test_http_response.py,66,make sure headers attribute is shallow copied,not
scrapy/tests/test_http_response.py,114,Empty attributes (which may fail if not compared properly),not
scrapy/tests/test_http_response.py,161,Response.follow,not
scrapy/tests/test_http_response.py,192,Response.follow_all,not
scrapy/tests/test_http_response.py,315,instantiate with unicode url without encoding (should set default encoding),not
scrapy/tests/test_http_response.py,319,make sure urls are converted to str,not
scrapy/tests/test_http_response.py,339,check body_as_unicode,not
scrapy/tests/test_http_response.py,343,check response.text,not
scrapy/tests/test_http_response.py,372,TextResponse (and subclasses) must be passed a encoding when instantiating with unicode bodies,not
scrapy/tests/test_http_response.py,396,w3lib < 1.19.0,not
scrapy/tests/test_http_response.py,397,w3lib >= 1.19.0,not
scrapy/tests/test_http_response.py,401,"Inferring encoding from body also cache decoded body as sideeffect,",not
scrapy/tests/test_http_response.py,402,this test tries to ensure that calling response.encoding and,not
scrapy/tests/test_http_response.py,403,response.text in indistint order doesn't affect final,not
scrapy/tests/test_http_response.py,404,values for encoding and decoded body.,not
scrapy/tests/test_http_response.py,409,Test response without content-type and BOM encoding,not
scrapy/tests/test_http_response.py,417,Body caching sideeffect isn't triggered when encoding is declared in,not
scrapy/tests/test_http_response.py,418,content-type header but BOM still need to be removed from decoded,not
scrapy/tests/test_http_response.py,419,body,not
scrapy/tests/test_http_response.py,430,XXX: Policy for replacing invalid chars may suffer minor variations,SATD
scrapy/tests/test_http_response.py,431,but it should always contain the unicode replacement char (u'\ufffd'),not
scrapy/tests/test_http_response.py,436,Do not destroy html tags due to encoding bugs,not
scrapy/tests/test_http_response.py,441,FIXME: This test should pass once we stop using BeautifulSoup's UnicodeDammit in TextResponse,SATD
scrapy/tests/test_http_response.py,442,"r = self.response_class(""http://www.example.com"", body=b'PREFIX\xe3\xabSUFFIX')",not
scrapy/tests/test_http_response.py,443,"assert u'\ufffd' in r.text, repr(r.text)",not
scrapy/tests/test_http_response.py,451,property is cached,not
scrapy/tests/test_http_response.py,522,select <a> elements,not
scrapy/tests/test_http_response.py,527,select <link> elements,not
scrapy/tests/test_http_response.py,534,href attributes should work,not
scrapy/tests/test_http_response.py,539,non-a elements are not supported,not
scrapy/tests/test_http_response.py,692,for conflicting declarations headers must take precedence,not
scrapy/tests/test_http_response.py,699,make sure replace() preserves the encoding of the original response,not
scrapy/tests/test_http_response.py,723,make sure replace() preserves the explicit encoding passed in the __init__ method,not
scrapy/tests/test_http_response.py,731,make sure replace() keeps the previous encoding unless overridden explicitly,not
scrapy/tests/test_http_response.py,747,property is cached,not
scrapy/tests/test_spidermiddleware_httperror.py,47,it assumes there is a response attached to failure,not
scrapy/tests/test_spidermiddleware_httperror.py,198,HttpError logs ignored responses with level INFO,not
scrapy/tests/test_spidermiddleware_httperror.py,210,"with level WARNING, we shouldn't capture anything from HttpError",not
scrapy/tests/test_utils_project.py,21,create an empty scrapy.cfg,SATD
scrapy/tests/test_spidermiddleware.py,28,catch deferred result and return the value,not
scrapy/tests/test_command_fetch.py,32,required on win32,not
scrapy/tests/test_spiderstate.py,36,"state attribute must be present if jobdir is not set, to provide a",not
scrapy/tests/test_spiderstate.py,37,consistent interface,not
scrapy/tests/test_exporters.py,203,datetime is not marshallable,not
scrapy/tests/mocks/dummydbm.py,22,return same instance for same file argument,not
scrapy/tests/test_spiderloader/__init__.py,10,ugly hack to avoid cyclic imports of scrapy.spiders when running this test,SATD
scrapy/tests/test_spiderloader/__init__.py,11,alone,not
scrapy/tests/test_spiderloader/__init__.py,129,copy 1 spider module so as to have duplicate spider name,not
scrapy/tests/test_spiderloader/__init__.py,150,copy 2 spider modules so as to have duplicate spider name,not
scrapy/tests/test_spiderloader/__init__.py,151,"This should issue 2 warning, 1 for each duplicate spider name",SATD
scrapy/tests/test_utils_misc/test_return_with_argument_inside_generator.py,37,not recursive,not
scrapy/tests/test_utils_misc/__init__.py,112,Check usage of correct constructor using four mocks:,not
scrapy/tests/test_utils_misc/__init__.py,113,1. with no alternative constructors,not
scrapy/tests/test_utils_misc/__init__.py,114,2. with from_settings() constructor,not
scrapy/tests/test_utils_misc/__init__.py,115,3. with from_crawler() constructor,not
scrapy/tests/test_utils_misc/__init__.py,116,4. with from_settings() and from_crawler() constructor,not
scrapy/tests/test_utils_misc/__init__.py,129,Check adoption of crawler settings,not
scrapy/tests/test_settings/__init__.py,49,Insufficient priority,not
scrapy/tests/test_settings/__init__.py,74,Note priority 30,not
scrapy/tests/test_settings/__init__.py,283,Empty settings should return 'default',not
scrapy/tests/test_cmdline/__init__.py,60,XXX: There's gotta be a smarter way to do this...,SATD
scrapy/docs/conf.py,1,"Scrapy documentation build configuration file, created by",SATD
scrapy/docs/conf.py,2,sphinx-quickstart on Mon Nov 24 12:02:52 2008.,not
scrapy/docs/conf.py,3,,not
scrapy/docs/conf.py,4,This file is execfile()d with the current directory set to its containing dir.,not
scrapy/docs/conf.py,5,,not
scrapy/docs/conf.py,6,"The contents of this file are pickled, so don't put values in the namespace",not
scrapy/docs/conf.py,7,"that aren't pickleable (module imports are okay, they're removed automatically).",not
scrapy/docs/conf.py,8,,not
scrapy/docs/conf.py,9,All configuration values have a default; values that are commented out,not
scrapy/docs/conf.py,10,serve to show the default.,not
scrapy/docs/conf.py,16,"If your extensions are in another directory, add it here. If the directory",not
scrapy/docs/conf.py,17,"is relative to the documentation root, use os.path.abspath to make it",not
scrapy/docs/conf.py,18,"absolute, like shown here.",not
scrapy/docs/conf.py,23,General configuration,not
scrapy/docs/conf.py,24,---------------------,not
scrapy/docs/conf.py,26,"Add any Sphinx extension module names here, as strings. They can be extensions",not
scrapy/docs/conf.py,27,coming with Sphinx (named 'sphinx.ext.*') or your custom ones.,not
scrapy/docs/conf.py,38,"Add any paths that contain templates here, relative to this directory.",not
scrapy/docs/conf.py,41,The suffix of source filenames.,not
scrapy/docs/conf.py,44,The encoding of source files.,not
scrapy/docs/conf.py,45,source_encoding = 'utf-8',not
scrapy/docs/conf.py,47,The master toctree document.,not
scrapy/docs/conf.py,50,General information about the project.,not
scrapy/docs/conf.py,54,"The version info for the project you're documenting, acts as replacement for",not
scrapy/docs/conf.py,55,"|version| and |release|, also used in various other places throughout the",not
scrapy/docs/conf.py,56,built documents.,not
scrapy/docs/conf.py,57,,not
scrapy/docs/conf.py,58,The short X.Y version.,not
scrapy/docs/conf.py,67,The language for content autogenerated by Sphinx. Refer to documentation,not
scrapy/docs/conf.py,68,for a list of supported languages.,not
scrapy/docs/conf.py,71,"There are two options for replacing |today|: either, you set today to some",not
scrapy/docs/conf.py,72,"non-false value, then it is used:",not
scrapy/docs/conf.py,73,today = '',not
scrapy/docs/conf.py,74,"Else, today_fmt is used as the format for a strftime call.",not
scrapy/docs/conf.py,75,"today_fmt = '%B %d, %Y'",not
scrapy/docs/conf.py,77,List of documents that shouldn't be included in the build.,not
scrapy/docs/conf.py,78,unused_docs = [],not
scrapy/docs/conf.py,82,"List of directories, relative to source directory, that shouldn't be searched",not
scrapy/docs/conf.py,83,for source files.,not
scrapy/docs/conf.py,86,The reST default role (used for this markup: `text`) to use for all documents.,not
scrapy/docs/conf.py,87,default_role = None,not
scrapy/docs/conf.py,89,"If true, '()' will be appended to :func: etc. cross-reference text.",not
scrapy/docs/conf.py,90,add_function_parentheses = True,not
scrapy/docs/conf.py,92,"If true, the current module name will be prepended to all description",not
scrapy/docs/conf.py,93,unit titles (such as .. function::).,not
scrapy/docs/conf.py,94,add_module_names = True,not
scrapy/docs/conf.py,96,"If true, sectionauthor and moduleauthor directives will be shown in the",not
scrapy/docs/conf.py,97,output. They are ignored by default.,not
scrapy/docs/conf.py,98,show_authors = False,not
scrapy/docs/conf.py,100,The name of the Pygments (syntax highlighting) style to use.,not
scrapy/docs/conf.py,104,Options for HTML output,not
scrapy/docs/conf.py,105,-----------------------,not
scrapy/docs/conf.py,107,The theme to use for HTML and HTML Help pages.  See the documentation for,not
scrapy/docs/conf.py,108,a list of builtin themes.,not
scrapy/docs/conf.py,111,Theme options are theme-specific and customize the look and feel of a theme,not
scrapy/docs/conf.py,112,"further.  For a list of options available for each theme, see the",not
scrapy/docs/conf.py,113,documentation.,not
scrapy/docs/conf.py,114,html_theme_options = {},not
scrapy/docs/conf.py,116,"Add any paths that contain custom themes here, relative to this directory.",not
scrapy/docs/conf.py,117,Add path to the RTD explicitly to robustify builds (otherwise might,not
scrapy/docs/conf.py,118,fail in a clean Debian build env),not
scrapy/docs/conf.py,123,The style sheet to use for HTML and HTML Help pages. A file of that name,not
scrapy/docs/conf.py,124,"must exist either in Sphinx' static/ path, or in one of the custom paths",not
scrapy/docs/conf.py,125,given in html_static_path.,not
scrapy/docs/conf.py,126,html_style = 'scrapydoc.css',SATD
scrapy/docs/conf.py,128,"The name for this set of Sphinx documents.  If None, it defaults to",not
scrapy/docs/conf.py,129,"""<project> v<release> documentation"".",not
scrapy/docs/conf.py,130,html_title = None,not
scrapy/docs/conf.py,132,A shorter title for the navigation bar.  Default is the same as html_title.,not
scrapy/docs/conf.py,133,html_short_title = None,not
scrapy/docs/conf.py,135,The name of an image file (relative to this directory) to place at the top,not
scrapy/docs/conf.py,136,of the sidebar.,not
scrapy/docs/conf.py,137,html_logo = None,not
scrapy/docs/conf.py,139,The name of an image file (within the static path) to use as favicon of the,not
scrapy/docs/conf.py,140,docs.  This file should be a Windows icon file (.ico) being 16x16 or 32x32,not
scrapy/docs/conf.py,141,pixels large.,not
scrapy/docs/conf.py,142,html_favicon = None,not
scrapy/docs/conf.py,144,"Add any paths that contain custom static files (such as style sheets) here,",not
scrapy/docs/conf.py,145,"relative to this directory. They are copied after the builtin static files,",not
scrapy/docs/conf.py,146,"so a file named ""default.css"" will overwrite the builtin ""default.css"".",not
scrapy/docs/conf.py,149,"If not '', a 'Last updated on:' timestamp is inserted at every page bottom,",not
scrapy/docs/conf.py,150,using the given strftime format.,not
scrapy/docs/conf.py,153,"Custom sidebar templates, maps document names to template names.",not
scrapy/docs/conf.py,154,html_sidebars = {},not
scrapy/docs/conf.py,156,"Additional templates that should be rendered to pages, maps page names to",not
scrapy/docs/conf.py,157,template names.,not
scrapy/docs/conf.py,158,html_additional_pages = {},not
scrapy/docs/conf.py,160,"If false, no module index is generated.",not
scrapy/docs/conf.py,161,html_use_modindex = True,not
scrapy/docs/conf.py,163,"If false, no index is generated.",not
scrapy/docs/conf.py,164,html_use_index = True,not
scrapy/docs/conf.py,166,"If true, the index is split into individual pages for each letter.",not
scrapy/docs/conf.py,167,html_split_index = False,not
scrapy/docs/conf.py,169,"If true, the reST sources are included in the HTML build as _sources/<name>.",not
scrapy/docs/conf.py,172,"If true, an OpenSearch description file will be output, and all pages will",not
scrapy/docs/conf.py,173,contain a <link> tag referring to it.  The value of this option must be the,not
scrapy/docs/conf.py,174,base URL from which the finished HTML is served.,not
scrapy/docs/conf.py,175,html_use_opensearch = '',not
scrapy/docs/conf.py,177,"If nonempty, this is the file name suffix for HTML files (e.g. "".xhtml"").",not
scrapy/docs/conf.py,178,html_file_suffix = '',not
scrapy/docs/conf.py,180,Output file base name for HTML help builder.,not
scrapy/docs/conf.py,184,Options for LaTeX output,not
scrapy/docs/conf.py,185,------------------------,not
scrapy/docs/conf.py,187,The paper size ('letter' or 'a4').,not
scrapy/docs/conf.py,188,latex_paper_size = 'letter',not
scrapy/docs/conf.py,190,"The font size ('10pt', '11pt' or '12pt').",not
scrapy/docs/conf.py,191,latex_font_size = '10pt',not
scrapy/docs/conf.py,193,Grouping the document tree into LaTeX files. List of tuples,not
scrapy/docs/conf.py,194,"(source start file, target name, title, author, document class [howto/manual]).",not
scrapy/docs/conf.py,200,The name of an image file (relative to this directory) to place at the top of,not
scrapy/docs/conf.py,201,the title page.,not
scrapy/docs/conf.py,202,latex_logo = None,not
scrapy/docs/conf.py,204,"For ""manual"" documents, if this is true, then toplevel headings are parts,",not
scrapy/docs/conf.py,205,not chapters.,not
scrapy/docs/conf.py,206,latex_use_parts = False,not
scrapy/docs/conf.py,208,Additional stuff for the LaTeX preamble.,not
scrapy/docs/conf.py,209,latex_preamble = '',not
scrapy/docs/conf.py,211,Documents to append as an appendix to all manuals.,not
scrapy/docs/conf.py,212,latex_appendices = [],not
scrapy/docs/conf.py,214,"If false, no module index is generated.",not
scrapy/docs/conf.py,215,latex_use_modindex = True,not
scrapy/docs/conf.py,218,Options for the linkcheck builder,not
scrapy/docs/conf.py,219,---------------------------------,not
scrapy/docs/conf.py,221,A list of regular expressions that match URIs that should not be checked when,not
scrapy/docs/conf.py,222,doing a linkcheck build.,not
scrapy/docs/conf.py,229,Options for the Coverage extension,not
scrapy/docs/conf.py,230,----------------------------------,not
scrapy/docs/conf.py,232,Contracts add_pre_hook and add_post_hook are not documented because,not
scrapy/docs/conf.py,233,"they should be transparent to contract developers, for whom pre_hook and",not
scrapy/docs/conf.py,234,post_hook should be the actual concern.,not
scrapy/docs/conf.py,237,"ContractsManager is an internal class, developers are not expected to",not
scrapy/docs/conf.py,238,interact with it directly in any way.,not
scrapy/docs/conf.py,241,For default contracts we only want to document their general purpose in,not
scrapy/docs/conf.py,242,"their __init__ method, the methods they reimplement to achieve that purpose",not
scrapy/docs/conf.py,243,should be irrelevant to developers using those contracts.,not
scrapy/docs/conf.py,246,"Methods of downloader middlewares are not documented, only the classes",not
scrapy/docs/conf.py,247,"themselves, since downloader middlewares are controlled through Scrapy",not
scrapy/docs/conf.py,248,settings.,not
scrapy/docs/conf.py,251,Base classes of downloader middlewares are implementation details that,not
scrapy/docs/conf.py,252,are not meant for users.,not
scrapy/docs/conf.py,255,Private exception used by the command-line interface implementation.,not
scrapy/docs/conf.py,258,Methods of BaseItemExporter subclasses are only documented in,not
scrapy/docs/conf.py,259,BaseItemExporter.,not
scrapy/docs/conf.py,262,Extension behavior is only modified through settings. Methods of,not
scrapy/docs/conf.py,263,"extension classes, as well as helper functions, are implementation",not
scrapy/docs/conf.py,264,details that are not documented.,not
scrapy/docs/conf.py,265,methods,not
scrapy/docs/conf.py,266,helper functions,not
scrapy/docs/conf.py,268,"Never documented before, and deprecated now.",not
scrapy/docs/conf.py,272,Implementation detail of LxmlLinkExtractor,not
scrapy/docs/conf.py,277,Options for the InterSphinx extension,not
scrapy/docs/conf.py,278,-------------------------------------,not
scrapy/docs/conf.py,292,Options for sphinx-hoverxref options,not
scrapy/docs/conf.py,293,------------------------------------,not
scrapy/docs/utils/linkfix.py,1,!/usr/bin/python,not
scrapy/docs/utils/linkfix.py,20,Used for remembering the file (and its contents),not
scrapy/docs/utils/linkfix.py,21,so we don't have to open the same file again.,not
scrapy/docs/utils/linkfix.py,25,A regex that matches standard linkcheck output lines,not
scrapy/docs/utils/linkfix.py,28,Read lines from the linkcheck output file,not
scrapy/docs/utils/linkfix.py,36,"For every line, fix the respective file",not
scrapy/docs/utils/linkfix.py,44,Broken links can't be fixed and,not
scrapy/docs/utils/linkfix.py,45,I am not sure what do with the local ones.,not
scrapy/docs/utils/linkfix.py,49,If this is a new file,not
scrapy/docs/utils/linkfix.py,52,Update the previous file,not
scrapy/docs/utils/linkfix.py,59,Read the new file to memory,not
scrapy/docs/utils/linkfix.py,65,We don't understand what the current line means!,not
scrapy/docs/_ext/scrapydocs.py,19,index entries for setting directives look like:,not
scrapy/docs/_ext/scrapydocs.py,20,"[(u'pair', u'SETTING_NAME; setting', u'std:setting-SETTING_NAME', '')]",not
scrapy/docs/_ext/scrapydocs.py,27,target nodes are placed next to the node in the doc tree,not
scrapy/scrapy/cmdline.py,18,TODO: add `name` attribute to commands and and merge this function with,SATD
scrapy/scrapy/cmdline.py,19,scrapy.utils.spider.iter_spider_classes,SATD
scrapy/scrapy/cmdline.py,113,set EDITOR from environment if available,not
scrapy/scrapy/cmdline.py,168,"Twisted prints errors in DebugInfo.__del__, but PyPy does not run gc.collect()",not
scrapy/scrapy/cmdline.py,169,on exit: http://doc.pypy.org/en/latest/cpython_differences.html?highlight=gc.collect#differences-related-to-garbage-collection-strategies,not
scrapy/scrapy/robotstxt.py,18,"If we found garbage or robots.txt in an encoding other than UTF-8, disregard it.",not
scrapy/scrapy/robotstxt.py,19,Switch to 'allow all' state.,not
scrapy/scrapy/logformatter.py,68,backward compatibility with Scrapy logformatter below 1.4 version,SATD
scrapy/scrapy/signals.py,25,for backward compatibility,not
scrapy/scrapy/squeues.py,85,Both pickle.PicklingError and AttributeError can be raised by pickle.dump(s),not
scrapy/scrapy/squeues.py,86,TypeError is raised from parsel.Selector,not
scrapy/scrapy/resolver.py,9,TODO: cache misses,SATD
scrapy/scrapy/resolver.py,38,"in Twisted<=16.6, getHostByName() is always called with",not
scrapy/scrapy/resolver.py,39,"a default timeout of 60s (actually passed as (1, 3, 11, 45) tuple),",not
scrapy/scrapy/resolver.py,40,so the input argument above is simply overridden,not
scrapy/scrapy/resolver.py,41,to enforce Scrapy's DNS_TIMEOUT setting's value,SATD
scrapy/scrapy/mail.py,113,Import twisted.mail here because it is not available in python3,not
scrapy/scrapy/shell.py,42,disable accidental Ctrl-C key press from shutting down the engine,not
scrapy/scrapy/shell.py,73,try all by default,not
scrapy/scrapy/shell.py,75,always add standard shell as fallback,not
scrapy/scrapy/exceptions.py,8,Internal,not
scrapy/scrapy/exceptions.py,24,HTTP and crawling,not
scrapy/scrapy/exceptions.py,44,Items,not
scrapy/scrapy/exceptions.py,57,Commands,not
scrapy/scrapy/dupefilters.py,17,can return deferred,not
scrapy/scrapy/dupefilters.py,20,can return a deferred,not
scrapy/scrapy/dupefilters.py,23,log that a request has been filtered,not
scrapy/scrapy/__init__.py,8,Scrapy version,SATD
scrapy/scrapy/__init__.py,15,Check minimum required Python version,not
scrapy/scrapy/__init__.py,21,Ignore noisy twisted deprecation warnings,not
scrapy/scrapy/__init__.py,26,Apply monkey patches to fix issues in external libraries,not
scrapy/scrapy/__init__.py,33,Declare top-level shortcuts,not
scrapy/scrapy/exporters.py,101,there is a small difference between the behaviour or JsonItemExporter.indent,not
scrapy/scrapy/exporters.py,102,and ScrapyJSONEncoder.indent. ScrapyJSONEncoder.indent=None is needed to prevent,SATD
scrapy/scrapy/exporters.py,103,the addition of newlines everywhere,not
scrapy/scrapy/exporters.py,203,Windows needs this https://github.com/scrapy/scrapy/issues/3034,SATD
scrapy/scrapy/exporters.py,217,list in value may not contain strings,not
scrapy/scrapy/exporters.py,242,for dicts try using fields of the first item,not
scrapy/scrapy/exporters.py,245,use fields declared in Item,not
scrapy/scrapy/_monkeypatches.py,4,Undo what Twisted's perspective broker adds to pickle register,not
scrapy/scrapy/_monkeypatches.py,5,to prevent bugs like Twisted#7989 while serializing requests,not
scrapy/scrapy/_monkeypatches.py,6,NOQA,not
scrapy/scrapy/_monkeypatches.py,7,Remove only entries with twisted serializers for non-twisted types.,not
scrapy/scrapy/item.py,78,avoid creating dict for most common case,not
scrapy/scrapy/pqueues.py,22,as we replace some letters we can get collision for different slots,not
scrapy/scrapy/pqueues.py,23,add we add unique part,not
scrapy/scrapy/pqueues.py,86,this may fail (eg. serialization error),not
scrapy/scrapy/pqueues.py,161,slot -> priority queue,not
scrapy/scrapy/crawler.py,10,zope >= 5.0 only supports MultipleInvalid,not
scrapy/scrapy/crawler.py,63,scrapy root handler already installed: update it with new settings,SATD
scrapy/scrapy/crawler.py,65,lambda is assigned to Crawler attribute because this way it is not,not
scrapy/scrapy/crawler.py,66,garbage collected after leaving __init__ scope,not
scrapy/scrapy/crawler.py,316,Don't start the reactor if the deferreds are already fired,not
scrapy/scrapy/crawler.py,327,blocking call,not
scrapy/scrapy/crawler.py,338,raised if already stopped or in shutdown stage,not
scrapy/scrapy/http/cookies.py,25,the cookiejar implementation iterates through all domains,not
scrapy/scrapy/http/cookies.py,26,instead we restrict to potential matches on the domain,not
scrapy/scrapy/http/cookies.py,50,This is still quite inefficient for large number of cookies,not
scrapy/scrapy/http/cookies.py,142,python3 uses attributes instead of methods,not
scrapy/scrapy/http/cookies.py,189,python3 cookiejars calls get_all,not
scrapy/scrapy/http/cookies.py,193,python2 cookiejars calls getheaders,not
scrapy/scrapy/http/response/__init__.py,125,type: (...) -> Request,not
scrapy/scrapy/http/response/__init__.py,164,"type: (...) -> Generator[Request, None, None]",not
scrapy/scrapy/http/response/text.py,43,used by encoding detection,not
scrapy/scrapy/http/response/text.py,74,access self.encoding before _cached_ubody to make sure,not
scrapy/scrapy/http/response/text.py,75,_body_inferred_encoding is called,not
scrapy/scrapy/http/response/text.py,130,type: (...) -> Request,not
scrapy/scrapy/http/response/text.py,172,"type: (...) -> Generator[Request, None, None]",not
scrapy/scrapy/http/response/text.py,236,type: (parsel.Selector) -> str,not
scrapy/scrapy/http/response/text.py,238,e.g. ::attr(href) result,not
scrapy/scrapy/http/request/rpc.py,24,spec defines that requests must use POST method,not
scrapy/scrapy/http/request/rpc.py,27,xmlrpc query multiples times over the same url,not
scrapy/scrapy/http/request/rpc.py,30,restore encoding,not
scrapy/scrapy/http/request/form.py,95,"Get form element from xpath, if not found, go up",not
